,0,1,title,paper_type,cite_number,award,names
2460,0.10435955398846035,-0.12839100344838217,A Visual Analytics Framework for the Detection of Anomalous Call Stack Trees in High Performance Computing Applications,0,2.0,1,Cong Xie;Wei Xu;Klaus Mueller
2461,0.46668646003307807,0.13273569376845393,Ray traced scalar fields with shaded polygonal output,1,0.0,0,R.J. Meyers;M.B. Stephenson
2462,0.08105680864614517,-0.25308155662254334,Two widely-different architectural approaches to computer image generation,1,0.0,0,H.W. Park;K.S. Eo;D.L. Kim;B.K. Choi;Y. Kim;T. Alexander
2463,0.46202090069577423,-0.09644409047599806,Direct volumetric visualization,1,0.0,0,R.D. Williams;F.L. Wefer;T.E. Clifton
2464,0.1641055357811099,0.05319233800026998,Orientation maps: Techniques for visualizing rotations (A  Consumer's Guide),1,0.0,0,B. Alpern;L. Carter;M. Grayson;C. Pelkie
2465,-0.07277858292833553,0.26425567371834235,Visualization and modeling of geophysical data,1,0.0,0,G. Celniker;I. Chakravarty;J. Moorman
2466,-0.02489787960413193,0.36787541855743244,Integrating spatial data display with virtual reconstruction,1,0.0,0,P. Peterson;B. Hayden;F.D. Fracchia
2467,-0.400780670688597,-0.13033999314928682,The design and implementation of the Cortex visualization system,1,0.0,0,D. Banerjee;C. Morley;W. Smith
2468,0.0969677234815502,-0.09307246224645468,Introducing alpha shapes for the analysis of path integral Monte Carlo results,1,0.0,0,P.J. Moran;M. Wagner
2469,-0.07352899388713725,0.14212460779330227,Visualizing polycrystalline orientation microstructures with spherical color maps,1,0.0,0,B. Yamrom;J.A. Sutliff;A.P. Woodfield
2470,-0.037710978318368595,-0.26069095347065485,Research report: improving browsing in information by the automatic display layout,1,0.0,0,P. Luders;R. Ernst
2471,0.2773305197745357,0.14420764601228625,Astronomers and their shady algorithms,1,0.0,0,R.E. Gooch
2472,-0.07724483166193824,-0.19283165069062388,Using visualization in the archaeological excavations of a pre-Inca temple in Peru,1,0.0,0,A.D. Kalvin;A. Remy;O. Ardito;K. Morla;E. Nolasco;J. Prado;R. Franco;A. Murga;G. Wiese
2473,-0.4021160812256892,0.3513392995639444,Data level comparative visualization in aircraft design,1,0.0,0,J. Trapp;H.-G. Pagendarm
2474,-0.188122836581113,0.11390296210719385,Case Study: Visual access for landscape event based temporal data,1,0.0,0,M. Sheelagh T. Carpendale;A. Fall;D.J. Cowperthwaite;J. Fall;F.D. Fracchia
2475,-0.217010365949869,0.05758592042252449,Visualization of plant growth,1,0.0,0,J.J. Loomis;Xiuwen Liu;Zhaohua Ding;K. Fujimura;M.L. Evans;H. Ishikawa
2476,0.15532228163148326,-0.11160421764508952,Comparative visualization of protein structure-sequence alignments,1,0.0,0,M. Hansen;D. Meads;A. Pang
2477,0.13575642779907407,-0.10992632675823881,Multi-Source Data Analysis Challenges,2,0.0,0,S. Uselton;J. Ahrens;W. Bethel;L. Treinish;A. State
2478,0.13575642779907407,-0.10992632675823881,Automation or interaction: what's best for big data?,2,0.0,0,D. Kenwright
2479,0.4719906046721968,0.045788767969241057,Mastering interactive surface rendering for Java-based diagnostic applications,1,0.0,0,L. Mroz;R. Wegenkittl;E. Groller
2480,-0.14730897115061578,-0.23577161750516806,PingTV: A Case Study in Visual Network Monitoring,1,0.0,0,A. Gubin;W. Yurcik;L. Brumbaugh
2481,0.045041202537196276,-0.05306518404042025,Case study: medical Web service for the automatic 3D documentation for neuroradiological diagnosis,1,0.0,0,S. Iserhardt-Bauer;P. Hastreiter;T. Ertl;K. Eberhardt;B. Tomandl
2482,-0.24047181194269035,-0.4294865189233805,Case study: visual debugging of cluster hardware,1,0.0,0,P. Crossno;R. Haynes
2483,-0.10213951638969841,-0.2760274465545531,Case study: an environment for understanding protein simulations using game graphics,1,0.0,0,D. Gresh;F. Suits;Yuk Yin Sham
2484,0.315998288768336,-0.19379481515503102,Exploring surface characteristics with interactive Gaussian images (a case study),1,0.0,0,B. Lowekamp;P. Rheingans;T.S. Yoo
2485,0.23422017326611685,-0.1811420031601708,An experimental evaluation of continuous semantic zooming in program visualization,1,0.0,0,K.L. Summers;T.E. Goldsmith;S. Kubica;T.P. Caudell
2486,0.16946708771271524,-0.26523722664231514,Conveying shape with texture: an experimental investigation of the impact of texture type on shape categorization judgments,1,0.0,0,Sunghee Kim;H. Hagh-Shenas;V. Interrante
2487,-0.20531953242263887,-0.053296123142410154,Visualizing spatial and temporal variability in coastal observatories,1,0.0,0,W.H. Jimenez;W.T. Correa;C.T. Silva;A.M. Baptista
2488,-0.1701395754717893,0.21701108020374416,EZEL: a Visual Tool for Performance Assessment of Peer-to-Peer File-Sharing Network,1,0.0,0,L. Voinea;A. Telea;J.J. van Wijk
2489,0.13575642779907407,-0.10992632675823881,Keynote Address: From Information Visualization to Sensemaking: Connecting the Mind's Eye to the Mind's Muscle,2,0.0,0,S. Card
2490,-0.16688018364729518,-0.2685134038468376,An Experimental Investigation of Magnification Lens Offset and Its Impact on Imagery Analysis,2,0.0,0,E. Darling;C. Newbern;N. Kalghatgi;A. Burgman;K. Recktenwald
2491,0.18210687402786682,-0.11113917440422594,TextPool: Visualizing Live Text Streams,2,0.0,0,C. Albrecht-Buehler;B. Watson;D.A. Shamma
2492,0.06552999213405541,-0.1730985241473322,ARNA: Interactive Comparison and Alignment of RNA Secondary Structure,2,0.0,0,G. Gainant;D. Auber
2493,0.2350103474038428,0.4099612404885566,Visualizing High Dimensional Datasets Using Partiview,2,0.0,0,D. Surendran;S. Levy
2494,0.09938814155998568,-0.35260589663679065,Intuitive and interactive modification of large finite element models,1,1.0,0,D. Rose;K. Bidmon;T. Ertl
2495,0.15178369550866153,0.2568350205684188,Highlighting conflict dynamics in event data,1,0.0,0,U. Brandes;D. Fleischer;J. Lerner
2496,-0.2153905140110238,0.2445986629122234,The software interface to the 3D-force microscope,1,0.0,0,D. Marshburn;C. Weigle;B.G. Wilde;R.M. Taylor;K. Desai;J.K. Fisher;J. Cribb;E.T. O'Brien;R. Superfine
2497,0.02693656054533121,0.10298940146789326,Complex Logarithmic Views for Small Details in Large Contexts,0,0.0,0,Joachim Bottger;Michael Balzer;Oliver Deussen
2498,-0.0444873290708277,-0.17823346101854465,Visualizing the Performance of Computational Linguistics Algorithms,1,0.0,0,Stephen G. Eick;Justin Mauger;Alan Ratner
2499,-0.10124191663733206,-0.2540795727571629,Visual Exploration of Spatio-temporal Relationships for Scientific Data,1,0.0,0,Sameep Mehta;Srinivasan Parthasarathy;Raghu Machiraju
2500,-0.30810000958827377,0.21282898173901996,Analyzing Complex FTMS Simulations: a Case Study in High-Level Visualization of Ion Motions,0,0.0,0,Wojciech Burakiewicz;Robert Van Liere
2501,0.03698908218289117,0.40234574659767214,IStar: A Raster Representation for Scalable Image and Volume Data,0,0.0,0,Joe Kniss;Warren Hunt;Kristin Potter;Pradeep Sen
2502,0.21880639102271662,-0.015522900383319388,Virtual Rheoscopic Fluids for Flow Visualization,0,0.0,0,William Barth;Christopher Burns
2503,0.2044480625798405,-0.12995199216606504,Interactive poster: Interactive multiobjective optimization - a new application area for visual analytics,2,0.0,0,Suvi Tarkkanen;Kaisa Miettinen;Jussi Hakanen
2504,0.38080539366078037,-0.001219900068480071,Volume Illustration of Muscle from Diffusion Tensor Images,0,1.0,0,Wei Chen;Zhicheng Yan;Song Zhang;John Allen Crow;David S. Ebert;Ronald M. McLaughlin;Katie B. Mullins;Robert Cooper;Zi'ang Ding;Jun Liao
2505,-0.329168246096487,0.3546253232100585,Automated measures for interpretable dimensionality reduction for visual classification: A user study,2,0.0,0,Ilknur Icke;Andrew Rosenberg
2506,-0.12833937838055517,0.233254079566223,epSpread - Storyboarding for visual analytics,2,0.0,0,Llyr ap Cenydd;Rick Walker;Serban Pop;Helen Miles;Chris Hughes;William Teahan;Jonathan C. Roberts
2507,0.10297734347780219,-0.08811463200664824,Artificial Defocus for Displaying Markers in Microscopy Z-Stacks,0,1.0,1,Alessandro Giusti;Pierluigi Taddei;Giorgio Corani;Luca Gambardella;Cristina Magli;Luca Gianaroli
2508,0.135809383567124,0.028736427609300553,Coherency-Based Curve Compression for High-Order finite Element Model Visualization,0,1.0,0,Alexander Bock;Erik Sundén;Bingchen Liu;Burkhard Wünsche;Timo Ropinski
2509,-0.07624755765441414,-0.2618199689726141,KnotPad: Visualizing and Exploring Knot Theory with Fluid Reidemeister Moves,0,1.0,0,Hui Zhang;Jianguang Weng;Lin Jing;Yiwen Zhong
2510,-0.15174719306696688,0.019430387346725933,Visual Data Analysis as an Integral Part of Environmental Management,0,0.0,0,Joerg Meyer;Glenn Taylor;Ben Torkian;Timothy C. Johnson;Ian Gorton;E. Wes Bethel;Jennifer L. Horsman;Susan S. Hubbard;Harinarayan Krishnan;Alexandru Romosan;Elizabeth H. Keating;Laura Monroe;Richard Strelitz;Phil Moore
2511,-0.3569342129280701,0.26922484486024423,Visual Steering and Verification of Mass Spectrometry Data Factorization in Air Quality Research,0,1.0,0,Daniel Engel;Klaus Greff;Christoph Garth;Keith Bein;Anthony Wexler;Bernd Hamann;Hans Hagen
2512,0.16256699397071936,-0.09288714610357358,A case study: Tracking and visualizing the evolution of dark matter halos and groups of satellite halos in cosmology simulations,2,0.0,0,Jay Takle;Deborah Silver;Katrin Heitmann
2513,-0.034807932661196986,0.06924788424316636,Visual exploration of local interest points in sets of time series,2,0.0,0,Tobias Schreck;Lyubka Sharalieva;Franz Wanner;Jürgen Bernard;Tobias Ruppert;Tatiana von Landesberger;Benjamin Bustos
2514,-0.24974898018117703,-0.27719881266032753,Exploring the impact of emotion on visual judgement,2,0.0,0,Lane Harrison;Remco Chang;Aidong Lu
2515,-0.13555131484135896,-0.0639946784464256,Smart super views---A knowledge-assisted interface for medical visualization,1,1.0,0,Gabriel Mistelbauer;Arnold Köchl;Rudiger Schernthaner;Ivan Baclija;Rüdiger Schernthaner;Stefan Bruckner;Milos Sramek;Meister Eduard Gröller
2516,-0.19336366259012416,-0.2922774808040266,Visualizing Request-Flow Comparison to Aid Performance Diagnosis in Distributed Systems,0,1.0,0,Raja R. Sambasivan;Ilari Shafer;Michelle L. Mazurek;Gregory R. Ganger
2517,-0.19129074786060848,-0.1958408079267812,Evaluation of Static and Dynamic Visualization Training Approaches for Users with Different Spatial Abilities,0,1.0,0,Maria-Elena Froese;Melanie Tory;Guy-Warwick Evans;Kedar Shrikhande
2518,0.297968667747251,0.03538998439606189,Predicate-Based Focus-and-Context Visualization for 3D Ultrasound,0,0.0,0,Christian Schulte zu Berge;Maximilian Baust;Ankur Kapoor;Nassir Navab
2519,-0.2270866584376075,-0.34082883074928005,Footprints: A Visual Search Tool that Supports Discovery and Coverage Tracking,0,1.0,0,Ellen Isaacs;Kelly Damico;Shane Ahern;Eugene Bart;Mudita Singhal
2520,0.014704937423633864,0.0461410962877249,A Classification of User Tasks in Visual Analysis of Volume Data,1,1.0,0,Bireswar Laha;Doug A. Bowman;David H. Laidlaw;John J. Socha
2521,-0.14670340363839487,-0.18549688604833073,Real-time Uncertainty Visualization for B-Mode Ultrasound,1,0.0,0,Christian Schulte Zu Berge;Denis Declara;Christoph Hennersperger;Maximilian Baust;Nassir Navab
2522,0.299451170227417,0.19227852286049604,"Extracting, Tracking, and Visualizing Magnetic Flux Vortices in 3D Complex-Valued Superconductor Simulation Data",0,1.0,0,Hanqi Guo;Carolyn L. Phillips;Tom Peterka;Dmitry Karpeyev;Andreas Glatz
2523,-0.05357810925741563,-0.12353103009511766,Visual Analytics for Development and Evaluation of Order Selection Criteria for Autoregressive Processes,0,1.0,0,Thomas Löwe;Emmy-Charlotte Förster;Georgia Albuquerque;Jens-Peter Kreiss;Marcus Magnor
2524,-0.21075982755149358,-0.3288247015219159,Synteny Explorer: An Interactive Visualization Application for Teaching Genome Evolution,0,2.0,0,Chris Bryan;Gregory Guterman;Kwan-Liu Ma;Harris Lewin;Denis Larkin;Jaebum Kim;Jian Ma;Marta Farré
2525,0.37472987601753954,0.028058647345466953,Glyphs for General Second-Order 2D and 3D Tensors,0,0.0,0,Tim Gerrits;Christian Rössl;Holger Theisel
2526,-0.18350317248944567,-0.08164881352085585,Categorical Colormap Optimization with Visualization Case Studies,0,2.0,0,H. Fang;S. Walton;E. Delahaye;J. Harris;D. A. Storchak;M. Chen
2527,-0.03669216114831153,0.3971455935410221,Correlated Photon Mapping for Interactive Global Illumination of Time-Varying Volumetric Data,0,1.0,1,Daniel Jönsson;Anders Ynnerman
2528,-0.006391153246631528,-0.21595731772556362,Blinded with Science or Informed by Charts? A Replication Study,0,2.0,0,Pierre Dragicevic;Yvonne Jansen
2529,0.17201400440732378,0.19662852329609673,Dynamic Load Balancing Based on Constrained K-D Tree Decomposition for Parallel Particle Tracing,0,1.0,0,Jiang Zhang;Hanqi Guo;Fan Hong;Xiaoru Yuan;Tom Peterka
2530,0.3020462783015778,0.03757255545315791,An Intelligent System Approach for Probabilistic Volume Rendering Using Hierarchical 3D Convolutional Sparse Coding,0,1.0,0,Tran Minh Quan;Junyoung Choi;Haejin Jeong;Won-Ki Jeong
2531,0.13635177111299956,-0.3222220081567174,Uncertainty Visualization Using Copula-Based Analysis in Mixed Distribution Models,0,2.0,0,Subhashis Hazarika;Ayan Biswas;Han-Wei Shen
2532,0.3189790929800253,0.03207016644111789,Interactive Dynamic Volume Illumination with Refraction and Caustics,0,1.0,0,Jens G. Magnus;Stefan Bruckner
2533,-0.36622867839932477,-0.0037120539363488213,Visualization Multi-Pipeline for Communicating Biology,0,1.0,0,Peter Mindek;David Kouřil;Johannes Sorger;Daniel Toloudis;Blair Lyons;Graham Johnson;M. Eduard Gröller;Ivan Viola
2534,0.099208124784822,0.33488670041681373,Globe Browsing: Contextualized Spatio-Temporal Planetary Surface Visualization,0,2.0,1,Karl Bladin;Emil Axelsson;Erik Broberg;Carter Emmart;Patric Ljung;Alexander Bock;Anders Ynnerman
2535,-0.14141643781295316,0.006711514236703822,BiDots: Visual Exploration of Weighted Biclusters,0,1.0,0,Jian Zhao;Maoyuan Sun;Francine Chen;Patrick Chiu
2536,0.00011601513646498869,-0.18208812472121186,Structure-Based Suggestive Exploration: A New Approach for Effective Exploration of Large Networks,0,2.0,0,Wei Chen;Fangzhou Guo;Dongming Han;Jacheng Pan;Xiaotao Nie;Jiazhi Xia;Xiaolong Zhang
2537,-0.21125556520229485,0.20265927227502517,A Declarative Rendering Model for Multiclass Density Maps,0,2.0,0,Jaemin Jo;Frédéric Vernier;Pierre Dragicevic;Jean-Daniel Fekete
2538,-0.018247928987702253,-0.1988767819297878,A Framework for Creative Visualization-Opportunities Workshops,0,2.0,0,Ethan Kerzner;Sarah Goodwin;Jason Dykes;Sara Jones;Miriah Meyer
2539,0.08982013127032297,0.017867618895932705,Persistence Atlas for Critical Point Variability in Ensembles,0,2.0,0,Guillaume Favelier;Noura Faraj;Brian Summa;Julien Tierny
2540,0.0185035614629178,-0.07443191295502738,Interactive Visualization of RNA and DNA Structures,0,1.0,0,Norbert Lindow;Daniel Baum;Morgan Leborgne;Hans-Christian Hege
2541,0.14605703551943125,-0.0768321665439305,Labels on Levels: Labeling of Multi-Scale Multi-Instance and Crowded 3D Biological Environments,0,2.0,1,David Kouřil;Ladislav Čmolík;Barbora Kozlíková;Hslanc-Yun Wu;Graham Johnson;David S. Goodsell;Arthur Olson;M. Eduard Gröller;Ivan Viola
2542,-0.01992080577674355,-0.4091059677318894,iForest: Interpreting Random Forests via Visual Analytics,0,2.0,0,Xun Zhao;Yanhong Wu;Dik Lun Lee;Weiwei Cui
2543,-0.15284452971471554,0.24074929593452832,Analysis of Flight Variability: a Systematic Approach,0,2.0,0,Natalia Andrienko;Gennady Andrienko;Jose Manuel Cordero Garcia;David Scarlatti
2544,-0.0805090891388716,0.004924884830044622,MAQUI: Interweaving Queries and Pattern Mining for Recursive Event Sequence Exploration,0,1.0,0,Po-Ming Law;Zhicheng Liu;Sana Malik;Rahul C. Basole
2545,0.1658186289722759,0.05590297205380914,MotionRugs: Visualizing Collective Trends in Space and Time,0,2.0,0,Juri Buchmüller;Dominik Jäckle;Eren Cakmak;Ulrik Brandes;Daniel A. Keim
2546,-0.27066939300314374,0.06669900991684254,Drag and Track: A Direct Manipulation Interface for Contextualizing Data Instances within a Continuous Parameter Space,0,2.0,0,Daniel Orban;Daniel F. Keefe;Ayan Biswas;James Ahrens;David Rogers
2547,0.4188146152941313,0.05797772285881241,Techniques for visualizing 3-dimensional manifolds,1,0.0,0,M.J. Laszlo
2548,-0.0004965380813814125,-0.3666966711051648,A graphical interface for robotic remediation of underground storage tanks,1,0.0,0,B.K. Christensen;L.M. Desjarlais
2549,-0.2748145826726537,0.07797136248269136,The electronic structure of oxygen in silicon as revealed by volume visualization of Ab initio calculations,1,0.0,0,R.H. Wolfe;M. Needels;J.D. Joannopoulos
2550,-0.17275844148073696,-0.09504864018418215,Visualizing environmental data for program decision support,1,0.0,0,J. Burnetti;R. Manley;W. Mitchell;D. Varnadore
2551,-0.0628659161169214,-0.13457335025180825,Flow visualization as a basic tool to investigate the dynamics and topology of jets,1,0.0,0,F.F. Grinstein;U.R. Obeysekare;G. Patnaik
2552,-0.022482286404950317,-0.009304499039774447,A climate simulation case study,1,0.0,0,P.C. Chen
2553,-0.019376172527399795,-0.3318246453329241,A 3D Contextual Shading Method for Visualization of Diecasting Defects,1,0.0,0,S.C. Lu;A.B. Rebello;D.H. Cui;R. Yagel;R.A. Miller;G.L. Kinzel
2554,-0.03657504867390734,0.06407569130043679,Rear-projecting virtual data onto physical terrain: an exercise in two senses being better than one,1,0.0,0,D. Clark;R. Marciano;R. McKeon;M. Bailey
2555,0.1080238050103532,-0.15434167183127473,DELTA's Virtual Physics Laboratory: a comprehensive learning platform on physics and astronomy,1,0.0,0,S. Chakaveh;U. Zlender;D. Skaley;K. Fostiropoulos;D. Breitschwerdt
2556,-0.20473920478776586,-0.3090552205121227,An integrated visualization and design toolkit for flexible prosthetic heart valves,1,0.0,0,A.J. Fenlon;T. David;J.P.R.B. Walton
2557,0.13575642779907407,-0.10992632675823881,Battlespace visualization: a grand challenge,2,0.0,0,J.L. Posdamer;J. Dantone;N. Gershon;J. Dale;T. Hamburger;W. Page
2558,0.3910820109817741,-0.03631270524805996,Approximate shading for the re-illumination of synthetic images,1,0.0,0,R. Scoggins;R. Machiraju;R.J. Moorhead
2559,0.16099244865263865,-0.0032327290386996855,Graphical strategies to convey functional relationships in the human brain: a case study,1,0.0,0,T. Welsh;K. Mueller;Wei Zhu;N. Volkow;J. Meade
2560,-0.08377144312904863,-0.1744239205957415,"Semi-immersive space mission design and visualization: case study of the ""Terrestrial Planet Finder"" mission",1,0.0,0,K. Museth;A. Barr;M.W. Lo
2561,-0.2320501149950158,0.36954450087505314,Visualizing biosequence data using texture mapping,1,0.0,0,P.R. Thiagarajan;G.R. Gao
2562,-0.15550867375660016,-0.11377701007644986,Exploding the frame: designing for wall-size computer displays,2,0.0,0,B. Shedd
2563,-0.1431481530112044,-0.2520481113478768,Psychophysical scaling of a cardiovascular information display,1,0.0,0,R. Albert;N. Syroid;Y. Zhang;J. Agutter;F. Drews;D. Strayer;G. Hutchinson;D. Westenskow
2564,0.4970199047489,0.1717645482322544,Fairing scalar fields by variational modeling of contours,1,0.0,0,M. Bertram
2565,0.13575642779907407,-0.10992632675823881,Capstone Address: Visualization as a Medium for Capturing and Sharing Thoughts,2,0.0,0,S. Roth
2566,-0.17775636837289824,-0.13798434034246584,Hypothesis Visualization,2,0.0,0,D. Cluxton;S.G. Eick;Jie Yun
2567,-0.048095930590425454,-0.06060544729656226,MonkEllipse: Visualizing the History of Information Visualization,2,0.0,0,Tzu-Wei Hsu;L. Inman;D. McColgin;K. Stamper
2568,-0.26809399437068426,-0.2645533417561042,Tracking User Interactions Within Visualizations,2,0.0,0,D.P. Groth;B.W. Murphy
2569,-0.2520414029043309,0.32081790403513577,Visualizing cortical waves and timing from data,1,0.0,0,K.A. Robbins;M. Robinson;D.M. Senseman
2570,0.48099249409945444,0.2562163443468457,Volume refinement fairing isosurfaces,1,0.0,0,M. Bertram
2571,-0.13897171261222097,-0.2634642639284875,Code Checking and Visualization of an Architecture Design,2,0.0,0,Rong Xu;W. Solihin;Zhiyong Huang
2572,0.13575642779907407,-0.10992632675823881,Automatic Fast Detection of Tumor Suspect Areas on CT Scan,2,0.0,0,M. Mancas;B. Gosselin;B. Macq
2573,0.3367245321068998,-0.01038866152786758,Exploring 2D tensor fields using stress nets,1,0.0,0,A. Wilson;R. Brannon
2574,0.3659629819351197,-0.03273502965241962,Composite Rectilinear Deformation for Stretch and Squish Navigation,0,0.0,0,James Slack;Tamara Munzner
2575,0.07708962683831001,-0.11717219505324108,InfoVis as Seen by the World Out There: 2007 in Review,2,0.0,0,Stephen Few
2576,-0.006039417048045696,-0.2880907636932949,Formalizing Analytical Discourse in Visual Analytics,2,0.0,0,Guoray Cai
2577,-0.27233806584043546,-0.1853391777292588,Intelligence Analysis Using Titan,2,0.0,0,Patricia Crossno;Brian Wylie;Andrew Wilson;John Greenfield;Eric Stanton;Timothy Shead;Lisa Ice;Kenneth Moreland;Jeffrey Baumes;Berk Geveci
2578,-0.01617331146133722,0.5822010362330068,Generating hypotheses of trends in high-dimensional data skeletons,1,0.0,0,Chandan K. Reddy;Snehal Pokharkar;Tin Kam Ho
2579,0.018435779997099465,-0.03115537776404855,Using SocialAction to uncover structure in social networks over time,2,0.0,0,Adam Perer
2580,-0.09482262723466788,-0.30309253280942294,SpicyNodes: Radial Layout Authoring for the General Public,0,1.0,0,Michael Douma;Grzegorz Ligierko;Ovidiu Ancuta;Pavel Gritsai;Sean Liu
2581,0.23501164594805357,0.12487512691716728,Geovisual analytics for self-organizing network data,1,0.0,0,Van Quan Ho;Tobias Astrom;Mikael Jern
2582,-0.0224227088419176,0.07295523139436887,Multiple step social structure analysis with Cytoscape,2,0.0,0,Hao Zhou;Anna A. Shaverdian;H.V. Jagadish;George Michailidis
2583,-0.14922189386170914,-0.16074629650219419,Detecting and analyzing relationships among anomalies,2,0.0,0,David Allen;Tsai-Ching Lu;Dave Huber
2584,-0.23932854196328648,0.41371146186953733,Integrative visual analytics for suspicious behavior detection,2,0.0,0,Peter Bak;Christian Rohrdantz;Svenja Leifert;Christoph Granacher;Stefan Koch;Simon Butscher;Patrick Jungk;Daniel A. Keim
2585,-0.19789280616913826,-0.26507202068588365,ALIDA: Using machine learning for intent discernment in visual analytics interfaces,2,0.0,0,Tera Marie Green;Ross Maciejewski;Steve DiPaola
2586,-0.1262806871809397,0.41001096309191254,Data representation and exploration with Geometric Wavelets,2,0.0,0,Eric E. Monson;Guangliang Chen;Rachael Brady;Mauro Maggioni
2587,-0.15223531958589753,-0.0627445380687889,KD-photomap: Exploring photographs in space and time,2,0.0,0,Iulian Peca;Haolin Zhi;Katerina Vrotsou;Natalia Andrienko;Gennady Andrienko
2588,-0.049718675562866424,0.11127682717523521,"An integrated visualization on network events VAST 2011 mini challenge #2 award: ""Outstanding integrated overview display""",2,0.0,0,Walter Marcelo Lamagna
2589,-0.19911048464038125,-0.27560942762742113,ManyVis: Multiple Applications in an Integrated Visualization Environment,0,1.0,0,Atul Rungta;Brian Summa;Dogan Demir;Peer-Timo Bremer;Valerio Pascucci
2590,-0.28162667035943173,0.41703703485372884,An Integrated Visual Analysis System for Fusing MR Spectroscopy and Multi-Modal Radiology Imaging,1,0.0,0,Miguel Nunes;Benjamin Rowland;Matthias Schlachter;Soléakhéna Ken;Kresimir Matkovic;Anne Laprie;Katja Bühler
2591,0.345729696387515,-0.12499407133287312,Feature-Based Tensor Field Visualization for Fiber Reinforced Polymers,1,0.0,0,Valentin Zobel;Markus Stommel;Gerik Scheuermann
2592,-0.07221203144777462,-0.3215622371274571,OpenSpace: Public dissemination of space mission profiles,2,0.0,0,Alexander Bock;Michal Marcinkowski;Joakim Kilby;Carter Emmart;Anders Ynnerman
2593,-0.12707260753063326,-0.32412218625157396,3D superquadric glyphs for visualizing myocardial motion,2,0.0,0,Teodora Chitiboi;Mathias Neugebauer;Susanne Schnell;Michael Markl;Lars Linsen
2594,-0.11810220608172975,0.521268895495816,Reconstruction and Visualization of Coordinated 3D Cell Migration Based on Optical Flow,0,2.0,0,Christopher P. Kappe;Lucas Schütz;Stefan Gunther;Lars Hufnagel;Steffen Lemke;Heike Leitte
2595,0.32177487069447114,0.15445280289394442,Multi-field Pattern Matching based on Sparse Feature Sampling,0,1.0,0,Zhongjie Wang;Hans-Peter Seidel;Tino Weinkauf
2596,-0.005408168159460641,0.06204549583473118,Visually and statistically guided imputation of missing values in univariate seasonal time series,2,0.0,0,M. Bögl;P. Filzmoser;T. Gschwandtner;S. Miksch;W. Aigner;A. Rind;T. Lammarsch
2597,-0.03941252995153256,-0.13250963470050037,Visual Analytics for fraud detection and monitoring,2,0.0,0,Roger A. Leite;Theresia Gschwandtner;Silvia Miksch;Erich Gstrein;Johannes Kuntner
2598,-0.16991878965387502,-0.05786562114399375,Quantifying the Visual Impact of Classification Boundaries in Choropleth Maps,0,2.0,0,Yifan Zhang;Ross Maciejewski
2599,0.3820641720539361,-0.08946589286337463,Backward Finite-Time Lyapunov Exponents in Inertial Flows,0,2.0,0,Tobias Günther;Holger Theisel
2600,0.1097370043918982,0.2225700410508365,Progressive Direct Volume-to-Volume Transformation,0,1.0,0,Steffen Frey;Thomas Ertl
2601,-0.3387657468489401,-0.31959470351589614,SocialBrands: Visual analysis of public perceptions of brands on social media,1,1.0,0,Xiaotong Liu;Anbang Xu;Liang Gou;Haibin Liu;Rama Akkiraju;Han-Wei Shen
2602,-0.04942103740837604,0.11008121359053512,Structuring Visualization Mock-Ups at the Graphical Level by Dividing the Display Space,0,2.0,0,Romain Vuillemot;Jeremy Boy
2603,0.023147979145089596,-0.2462414635204036,Understanding the Relationship Between Interactive Optimisation and Visual Analytics in the Context of Prostate Brachytherapy,0,1.0,0,Jie Liu;Tim Dwyer;Kim Marriott;Jeremy Millar;Annette Haworth
2604,-0.13762881649337824,-0.36540954593972796,Graphiti: Interactive Specification of Attribute-Based Edges for Network Modeling and Visualization,0,1.0,0,Arjun Srinivasan;Hyunwoo Park;Alex Endert;Rahul C. Basole
