,0,1,title,paper_type,cite_number,award,names
1723,0.5648883782921795,-0.1888562282141433,Text Scaffolds for Effective Surface Labeling,0,1.0,0,Gregory Cipriano;Michael Gleicher
1724,-0.28182230765579075,-0.28482876126285983,NetClinic: Interactive visualization to enhance automated fault diagnosis in enterprise networks,1,0.0,0,Zhicheng Liu;Bongshin Lee;Srikanth Kandula;Ratul Mahajan
1725,0.29858093855095336,0.1730885478183087,Direct Interval Volume Visualization,0,1.0,0,Marco Ament;Daniel Weiskopf;Hamish Carr
1726,-0.03787785602950519,0.3812328594667414,On the Fractal Dimension of Isosurfaces,0,0.0,0,Marc Khoury;Rephael Wenger
1727,-0.2589977181849469,-0.43060397634692,A two-stage framework for designing visual analytics system in organizational environments,1,2.0,0,Xiaoyu Wang;Wenwen Dou;Thomas Butkiewicz;Eric A. Bier;William Ribarsky
1728,0.14326400013747037,-0.0009225250597952684,Asymmetric Tensor field Visualization for Surfaces,0,1.0,0,Darrel Palke;Zhongzang Lin;Guoning Chen;Harry Yeh;Paul Vincent;Robert Laramee;Eugene Zhang
1729,0.18509054409703302,0.15138044141383036,Comparing Clusterings Using Bertin's Idea,0,1.0,0,Alexander Pilhöfer;Alexander Gribov;Antony Unwin
1730,0.5303632941555364,-0.043623698564979295,Generalized Topological Simplification of Scalar fields on Surfaces,0,0.0,0,Julien Tierny;Valerio Pascucci
1731,-0.06279875042957393,0.3158985967224907,Visualization of Temporal Similarity in field Data,0,1.0,0,Steffen Frey;Filip Sadlo;Thomas Ertl
1732,-0.1762713402068456,-0.29099699236261706,The Deshredder: A visual analytic approach to reconstructing shredded documents,1,1.0,0,Patrick Butler;Prithwish Chakraborty;Naren Ramakrishan
1733,-0.08810191926580083,-0.154871538380712,"Interactive Visualizations on Large and Small Displays: The Interrelation of Display Size, Information Space, and Scale",0,1.0,0,Mikkel R. Jakobsen;Kasper Hornbæk
1734,-0.22027429403308846,-0.20388323956519844,An Exploration Framework to Identify and Track Movement of Cloud Systems,0,1.0,0,Harish Doraiswamy;Vijay Natarajan;Ravi S. Nanjundiah
1735,0.41600053742580345,-0.10484155180140098,Interactive Patient-Specific Vascular Modeling with Sweep Surfaces,0,2.0,0,Jan Kretschmer;Christian Godenschwager;Bernhard Preim;Marc Stamminger
1736,-0.20562058210173717,-0.31370367842146213,Transformation of an Uncertain Video Search Pipeline to a Sketch-Based Visual Analytics Loop,0,1.0,0,Philip A. Legg;David H.S. Chung;Matthew L. Parry;Rhodri Bown;Mark W. Jones;Iwan W. Griffiths;Min Chen
1737,-0.10406680346468387,-0.1272564703965826,LiveGantt: Interactively Visualizing a Large Manufacturing Schedule,0,1.0,0,Jaemin Jo;Jaeseok Huh;Jonghun Park;Bohyoung Kim;Jinwook Seo
1738,-0.023812889147936375,0.15587684366024837,Interactive Progressive Visualization with Space-Time Error Control,0,1.0,0,Steffen Frey;Filip Sadlo;Kwan-Liu Ma;Thomas Ertl
1739,-0.26047143759905,-0.2382987888754759,Visual Analytics for Complex Engineering Systems: Hybrid Visual Steering of Simulation Ensembles,0,1.0,0,Kreŝimir Matković;Denis Gračanin;Rainer Splechtna;Mario Jelović;Benedikt Stehno;Helwig Hauser;Werner Purgathofer
1740,-0.0475129999316724,-0.05150351787133338,Visual Analysis of Public Utility Service Problems in a Metropolis,0,1.0,0,Jiawan Zhang;E Yanli;Jing Ma;Yahui Zhao;Binghan Xu;Liting Sun;Jinyan Chen;Xiaoru Yuan
1741,0.0023450180984347833,0.05784124001249376,CAST: Effective and Efficient User Interaction for Context-Aware Selection in 3D Particle Clouds,0,2.0,0,Lingyun Yu;Konstantinos Efstathiou;Petra Isenberg;Tobias Isenberg
1742,0.11260223856816708,0.004289727392772209,Interstitial and Interlayer Ion Diffusion Geometry Extraction in Graphitic Nanosphere Battery Materials,0,2.0,0,Attila Gyulassy;Aaron Knoll;Kah Chun Lau;Bei Wang;Peer-Timo Bremer;Michael E. Papka;Larry A. Curtiss;Valerio Pascucci
1743,-0.12910857390328626,-0.05766933070635465,NeuroBlocks - Visual Tracking of Segmentation and Proofreading for Large Connectomics Projects,0,1.0,0,Ali K. Ai-Awami;Johanna Beyer;Daniel Haehn;Narayanan Kasthuri;Jeff W. Lichtman;Hanspeter Pfister;Markus Hadwiger
1744,-0.22754838461191493,-0.15549568702795621,SensePath: Understanding the Sensemaking Process Through Analytic Provenance,0,1.0,0,Phong H. Nguyen;Kai Xu;Ashley Wheat;B.L. William Wong;Simon Attfield;Bob Fields
1745,0.11758312653639573,0.02379569716933603,Time-Hierarchical Clustering and Visualization of Weather Forecast Ensembles,0,2.0,0,Florian Ferstl;Mathias Kanzler;Marc Rautenhaus;Rüdiger Westermann
1746,-0.19667745007552595,0.30105068270352175,In Situ Distribution Guided Analysis and Visualization of Transonic Jet Engine Simulations,0,2.0,1,Soumya Dutta;Chun-Ming Chen;Gregory Heinlein;Han-Wei Shen;Jen-Ping Chen
1747,-0.12878281961059887,0.2269364990691566,"Exploring Multivariate Event Sequences Using Rules, Aggregations, and Selections",0,1.0,0,Bram C.M. Cappers;Jarke J. van Wijk
1748,0.037238085643004765,-0.2866194358591333,Visual Diagnosis of Tree Boosting Methods,0,2.0,0,Shixia Liu;Jiannan Xiao;Junlin Liu;Xiting Wang;Jing Wu;Jun Zhu
1749,-0.23796488888830264,-0.41294958921507113,RetainVis: Visual Analytics with Interpretable and Interactive Recurrent Neural Networks on Electronic Medical Records,0,2.0,0,Bum Chul Kwon;Min-Je Choi;Joanne Taery Kim;Edward Choi;Young Bin Kim;Soonwook Kwon;Jimeng Sun;Jaegul Choo
1750,0.09347976060663112,-0.24008952959412003,Visualizing computer memory architectures,1,0.0,0,B. Alpern;L. Carter;T. Selker
1751,0.020446777657399856,-0.3322360968084476,Golf green visualization,1,0.0,0,W.E. Lorensen;B. Yamron
1752,0.18358534047060585,-0.11142601245101777,Virtual spacetime: an environment for the visualization of curved spacetimes via geodesic flows,1,0.0,0,S. Bryson
1753,0.3564562295979637,-0.11483828133710089,Generalized focal surfaces: a new method for surface interrogation,1,0.0,0,H. Hagen;S. Hahmann
1754,0.1227931020969882,0.5989904568712426,High-speed volume rendering using redundant block compression,1,0.0,0,G. Knittel
1755,-0.17907261649332018,0.47788889723150224,Authenticity analysis of wavelet approximations in visualization,1,0.0,0,Pak Chung Wong;R.D. Bergeron
1756,-0.20840631462510176,-0.18331981681185866,Rapid prototyping of information visualizations using VANISH,1,0.0,0,R. Kazman;J. Carriere
1757,0.2490675527191155,0.22588552820556237,FEL: The Field Encapsulation Library,1,0.0,0,S. Bryson;D. Kenwright;M. Gerald-Yamasaki
1758,0.049639725952189115,0.3275317394811763,Three Dimensional Visualization of Proteins in Cellular Interactions,1,0.0,0,C.R.F. Monks;P.J. Crossno;G. Davidson;C. Pavlakos;A. Kupfer;C. Silva;B. Wylie
1759,0.6163458084880107,0.08960446646346942,Extremal feature extraction from 3-D vector and noisy scalar fields,1,0.0,0,C.-K. Tang;G. Medioni
1760,0.4234193320428415,-0.0976518390865131,Interactive deformations from tensor fields,1,1.0,0,E. Boring;A. Pang
1761,0.20368564203059933,0.271893245420291,Hierarchical volume analysis and visualization based on morphological operators,1,0.0,0,C. Lurig;T. Ertl
1762,0.024402589582756005,-0.05840614969023579,Structured spatial domain image and data comparison metrics,1,0.0,0,N. Sahasrabudhe;J.E. West;R. Machiraju;M. Janus
1763,0.2490795101887706,0.0012730635031617892,Interactive lens visualization techniques,1,0.0,0,C.D. Shaw;J.A. Hall;D.S. Ebert;D.A. Roberts
1764,0.25274804506477894,-0.05153395360490729,Real-world relativity: image-based special relativistic visualization,1,1.0,0,D. Weiskopf;D. Kobras;H. Ruder
1765,0.04993680357172993,-0.02667884664003843,Interactive visualization of protein dynamics,1,0.0,0,H. Huitema;R. Van Liere
1766,-0.22644622108935808,0.3377307257467414,Visual data fusion for applications of high-resolution numerical weather prediction,1,0.0,0,L.A. Treinish
1767,0.1517190592516374,-0.08037302517904574,A virtual environment for simulated rat dissection: a case study of visualization for astronaut training,1,0.0,0,K. Montgomery;C. Bruyns;S. Wildermuth
1768,0.12677652490541227,0.46671225123498095,Rendering the first star in the Universe - A case study,1,0.0,0,R. Kahler;D. Cox;R. Patterson;S. Levy;H.-C. Hege;T. Abel
1769,0.25899204217160904,-0.0803003193284356,Visibility based methods and assessment for detail-recovery,1,0.0,0,M. Tarini;P. Cignoni;R. Scopigno
1770,0.48871589851190184,0.15610090441585095,Scale-invariant volume rendering,1,0.0,0,M. Kraus
1771,0.1472036131041551,-0.31515544237410903,Visualizing the tightening of knots,1,1.0,0,J. Cantarella;M. Piatek;E. Rawdon
1772,-0.1720243760568463,0.26147303826087287,Subjective Quantification of Perceptual Interactions among some 2D Scientific Visualization Methods,0,1.0,0,Daniel Acevedo;David Laidlaw
1773,-0.33317883373379675,0.212879841770886,LAHVA: Linked Animal-Human Health Visual Analytics,1,0.0,0,Ross Maciejewski;Benjamin Tyner;Yun Jang;Cheng Zheng;Rimma V. Nehme;David S. Ebert;William S. Cleveland;Mourad Ouzzani;Shaun J. Grannis;Lawrence T. Glickman
1774,-0.22314327740260106,-0.2328703259141141,Visual Analytics Approach to User-Controlled Evacuation Scheduling,1,0.0,0,Gennady Andrienko;Natalia Andrienko;Ulrich Bartling
1775,0.17003998738807097,0.08715336265149383,Interactive Isosurface Ray Tracing of Time-Varying Tetrahedral Volumes,0,1.0,0,Ingo Wald;Heiko Friedrich;Aaron Knoll;Charles D. Hansen
1776,-0.30455256364835676,-0.28334758862458304,The Scalable Reasoning System: Lightweight visualization for distributed analytics,1,0.0,0,William A. Pike;Joe Bruce;Bob Baddeley;Daniel Best;Lyndsey Franklin;Richard May;Douglas M. Rice;Rick Riensche;Katarina Younkin
1777,0.3483601425166808,0.24066749054240708,Smooth Surface Extraction from Unstructured Point-based Volume Data Using PDEs,0,1.0,0,Paul Rosenthal;Lars Linsen
1778,0.0625448109143765,-0.1657037730231773,Visualizing Particle/Flow Structure Interactions in the Small Bronchial Tubes,0,1.0,0,Bela Soni;David Thompson;Raghu Machiraju
1779,0.3807458767466606,0.024100315924864068,"High-Quality, Semi-Analytical Volume Rendering for AMR Data",0,0.0,0,Stephane Marchesin;Guillaume Colin De Verdiere
1780,0.08272963713899496,-0.07055609269910465,Verifiable Visualization for Isosurface Extraction,0,0.0,0,Tiago Etiene;Carlos Scheidegger;Luis Gustavo Nonato;Robert Mike Kirby;Cláudio Silva
1781,0.23100662305681097,0.0016896524659651216,Edge Aware Anisotropic Diffusion for 3D Scalar Data,0,1.0,0,Zahid Hosssain;Torsten Moller
1782,0.2657069724239818,0.15058166371603604,A Scale Space Based Persistence Measure for Critical Points in 2D Scalar fields,0,1.0,0,Jan Reininghaus;Natallia Kotava;David Guenther;Jens Kasten;Hans Hagen;Ingrid Hotz
1783,0.07668413093074986,0.061366120267554475,iView: A Feature Clustering Framework for Suggesting Informative Views in Volume Visualization,0,1.0,0,Ziyi Zheng;Nafees Ahmed;Klaus Mueller
1784,-0.2957184000183397,-0.16698532765740534,Variant View: Visualizing Sequence Variants in their Gene Context,0,1.0,0,Joel A. Ferstay;Cydney B. Nielsen;Tamara Munzner
1785,-0.151953688217099,0.16157378895724503,Visual Analytics for Comparison of Ocean Model Output with Reference Data: Detecting and Analyzing Geophysical Processes Using Clustering Ensembles,0,1.0,0,Patrick Köthur;Mike Sips;Henryk Dobslaw;Doris Dransch
1786,-0.07287730400153869,0.004573284683393821,Occlusion-free Blood Flow Animation with Wall Thickness Visualization,0,1.0,0,Kai Lawonn;Sylvia Glaßer;Anna Vilanova;Bernhard Preim;Tobias Isenberg
1787,-0.2841541049454944,0.37468894329759467,Urbane: A 3D framework to support data driven decision making in urban development,1,1.0,0,Nivan Ferreira;Marcos Lage;Harish Doraiswamy;Huy Vo;Luc Wilson;Heidi Werner;Muchan Park;Cláudio Silva
1788,-0.021221879053228,-0.20668196606236222,Evaluation of Graph Sampling: A Visualization Perspective,0,2.0,0,Yanhong Wu;Nan Cao;Daniel Archambault;Qiaomu Shen;Huamin Qu;Weiwei Cui
1789,-0.08892805932629336,-0.1545954710590551,Blockwise Human Brain Network Visual Comparison Using NodeTrix Representation,0,1.0,0,Xinsong Yang;Lei Shi;Madelaine Daianu;Hanghang Tong;Qingsong Liu;Paul Thompson
1790,-0.05205751822144152,-0.2425242360721557,"The Good, the Bad, and the Ugly: A Theoretical Framework for the Assessment of Continuous Colormaps",0,2.0,0,Roxana Bujack;Terece L. Turton;Francesca Samsel;Colin Ware;David H. Rogers;James Ahrens
1791,-0.2201493910847035,-0.1364215244164627,Visualizing Confidence in Cluster-Based Ensemble Weather Forecast Analyses,0,2.0,0,Alexander Kumpf;Bianca Tost;Marlene Baumgart;Michael Riemer;Rüdiger Westermann;Marc Rautenhaus
1792,-0.22465276666333497,-0.1703412937361446,What Do We Talk About When We Talk About Dashboards?,0,2.0,0,Alper Sarikaya;Michael Correll;Lyn Bartram;Melanie Tory;Danyel Fisher
1793,0.17874497329856165,-0.32980661297703745,Extracting geometric models through constraint minimization,1,0.0,0,J.V. Miller;D.E. Breen;M.J. Wozny
1794,0.5958088314340472,-0.12231433933742258,Wide-band relativistic Doppler effect visualization,1,0.0,0,P.-K. Hsiung;R.H. Thibadeau;C.B. Cox;R.H.P. Dunn;M. Wu;P.A. Olbrich
1795,-0.23514374146155595,-0.33214342610164405,Integration of visualization and scientific calculation in a software system,1,0.0,0,U. Lang;R. Lang;R. Ruhle
1796,0.3648595391056165,-0.06414879376500264,A library for visualizing combinatorial structures,1,0.0,0,M.A. Najork;M.H. Brown
1797,-0.20673591912053005,-0.30641300584584136,DEPICT: Documents Evaluated as Pictures. Visualizing information using context vectors and self-organizing maps,1,0.0,0,D.A. Rushall;M.R. Ilgen
1798,0.228630935184857,0.11401487775539304,Raycasting vector fields,1,0.0,0,T. Fruhauf
1799,0.3082804426855432,0.4999606841476314,Real-time slicing of data space,1,1.0,0,R.A. Crawfis
1800,-0.4260380218918201,0.05505001321695065,Cacti: a front end for program visualization,1,0.0,0,S.P. Reiss
1801,-0.10877320432781637,-0.14626312336068895,BiblioMapper: a cluster-based information visualization technique,1,0.0,0,Min Song
1802,-0.1989881623986869,0.25442519944592756,Production visualization for the ASCI One TeraFLOPS machine,1,0.0,1,P.D. Heermann
1803,0.0028505217306213303,0.04713525929661311,A case study using the virtual environment for reconstructive surgery,1,0.0,0,K. Montgomery;M. Stephanides;S. Schendel;M. Ross
1804,0.1387529591266965,-0.08487082614525909,Three-dimensional visualization of microstructures,1,0.0,0,M. Lanzagorta;M.V. Kral;J.E. Swan;G. Spanos;R. Rosenberg;E. Kuo
1805,-0.19300294773869123,0.01548222140428139,Visualizing massive multi-digraphs,1,0.0,0,J. Abello;J. Korn
1806,-0.07753396724278269,-0.2709916961132055,Navigating high-dimensional spaces to support design steering,1,0.0,0,H. Wright;K. Brodlie;T. David
1807,0.005112512325983111,-0.24407321020386866,User-centric viewpoint computation for haptic exploration and manipulation,1,1.0,0,M.A. Otaduy;M.C. Lin
1808,0.1272284639275314,0.03209781065888625,Interactive spectral volume rendering,1,1.0,0,S. Bergner;T. Moller;M.S. Drew;G.D. Finlayson
1809,-0.1250524358309911,-0.4196952382950849,Evaluation of a multimodal interface for 3D terrain visualization,1,0.0,0,D.M. Krum;O. Omoteso;W. Ribarsky;T. Starner;L.F. Hodges
1810,0.0927853997879309,-0.2724676281911465,A model of multi-scale perceptual organization in information graphics,1,1.0,0,M. Wattenberg;D. Fisher
1811,0.013813764089617618,0.4295215361173014,Feature-space analysis of unstructured meshes,1,1.0,0,A. Shamir
1812,-0.15441631056173205,-0.3292410286293203,Expand-Ahead: A Space-Filling Strategy for Browsing Trees,1,0.0,0,M.J. McGuffin;G. Davison;R. Balakrishnan
1813,-0.10518819478931168,0.38914344528521555,Vol-a-Tile - A Tool for Interactive Exploration of Large Volumetric Data on Scalable Tiled Displays,2,0.0,0,N. Schwarz;S. Venkataraman;Luc Renambot;N. Krishnaprasad;V. Vishwanath;J. Leigh;A. Johnson;G. Kent;A. Nayak
1814,0.4090466987537869,-0.031698395570374,Compatible triangulations of spatial decompositions,1,1.0,0,W.J. Schroeder;B. Geveci;M. Malaterre
1815,0.12598600983030186,0.5362031554636081,Generating sub-resolution detail in images and volumes using constrained texture synthesis,1,0.0,0,Lujin Wang;K. Mueller
1816,0.07474494242405218,-0.07630888624465748,Non-linear model fitting to parameterize diseased blood vessels,1,0.0,0,A. La Cruz;M. Straka;A. Kochl;M. Sramek;E. Groller;D. Fleischmann
1817,-0.01893385668903332,0.029456439228549732,Simple 3D glyphs for spatial multivariate data,1,0.0,0,C. Forsell;S. Seipel;M. Lind
1818,0.5156346363492912,-0.22768706895163293,Multimodal exploration of the fourth dimension,1,1.0,0,A.J. Hanson;H. Zhang
1819,0.5012333196291505,-0.14037594191837274,Reconstructing manifold and non-manifold surfaces from point clouds,1,0.0,0,J. Wang;M.M. Oliveira;A.E. Kaufman
1820,0.32764273808951494,-0.18404156506437122,Visualization of Barrier Tree Sequences,0,0.0,0,Christian Heine;Gerik Scheuermann;Christoph Flamm;Ivo L. Hofacker;Peter F. Stadler
1821,-0.21752975873532224,0.4566184018118662,Visualizing Multiwavelength Astrophysical Data,0,2.0,0,Hongwei Li;Chi-Wing Fu;Andrew Hanson
1822,-0.06602703935940722,0.08049228618921701,LSAView: A tool for visual exploration of latent semantic modeling,1,0.0,0,Patricia J. Crossno;Daniel M. Dunlavy;Timothy M. Shead
1823,-0.2064044135533986,-0.04528942495493498,Visualizations everywhere: A Multiplatform Infrastructure for Linked Visualizations,0,0.0,0,Danyel Fisher;Steven Drucker;Roland Fernandez;Scott Ruble
1824,-0.3416305974625785,0.0912647248151785,A closer look at note taking in the co-located collaborative visual analytics process,1,1.0,0,Narges Mahyar;Ali Sarvghad;Melanie Tory
1825,-0.404591917145982,0.2763791846303326,Scalable Multi-variate Analytics of Seismic and Satellite-based Observational Data,0,1.0,0,Xiaoru Yuan;He Xiao;Hanqi Guo;Peihong Guo;Wesley Kendall;Jian Huang;Yongxian Zhang
1826,-0.017574097701102322,0.08132384437705212,Spatial Conditioning of Transfer Functions Using Local Material Distributions,0,1.0,0,Stefan Lindholm;Patric Ljung;Claes Lundstrom;Anders Persson;Anders Ynnerman
1827,-0.15867837621764444,-0.08177590417718174,Visual Optimality and Stability Analysis of 3DCT Scan Positions,0,0.0,0,Artem Amirkhanov;Christoph Heinzl;Michael Reiter;Eduard Groller
1828,0.3764314058793498,-0.04551195967581059,Crepuscular Rays for Tumor Accessibility Planning,0,1.0,0,Rostislav Khlebnikov;Bernhard Kainz;Judith Muehl;Dieter Schmalstieg
1829,0.09919944715496672,-0.1754851188054135,Distance Visualization for Interactive 3D Implant Planning,0,0.0,0,Christian Dick;Rainer Burgkart;Rudiger Westermann
1830,0.1561591258570614,0.08432297309239511,Projection-Based Metal-Artifact Reduction for Industrial 3D X-ray Computed Tomography,0,1.0,0,Artem Amirkhanov;Christoph Heinzl;Michael Reiter;Johann Kastner;Eduard Groller
1831,-0.33878937766382367,-0.1796045774103661,RelEx: Visualization for Actively Changing Overlay Network Specifications,0,1.0,0,Michael Sedlmair;Annika Frank;Tamara Munzner;Andreas Butz
1832,-0.3874854797277826,0.2378813540974091,Watch this: A taxonomy for dynamic data visualization,1,1.0,0,Joseph A. Cottam;Andrew Lumsdaine;Chris Weaver
1833,-0.21042381607051527,-0.2655399720049216,Using Concrete Scales: A Practical Framework for Effective Visual Depiction of Complex Measures,0,1.0,0,Fanny Chevalier;Romain Vuillemot;Guia Gali
1834,-0.008560148043607664,-0.30711560052114645,Characterizing and Visualizing Predictive Uncertainty in Numerical Ensembles Through Bayesian Model Averaging,0,1.0,0,Luke Gosink;Kevin Bensema;Trenton Pulsipher;Harald Obermaier;Michael Henry;Hank Childs;Kenneth I. Joy
1835,-0.10582599249178512,0.2431909437908459,TimeBench: A Data Model and Software Library for Visual Analytics of Time-Oriented Data,0,2.0,0,Alexander Rind;Tim Lammarsch;Wolfgang Aigner;Bilal Alsallakh;Silvia Miksch
1836,-0.3161227751614141,-0.23269179321397954,Moving beyond sequential design: Reflections on a rich multi-channel approach to data visualization,0,2.0,0,Jo Wood;Roger Beecham;Jason Dykes
1837,0.03554525479627712,0.5442436784734522,Fast and Memory-Efficienty Topological Denoising of 2D and 3D Scalar Fields,0,0.0,0,David Günther;Alec Jacobson;Jan Reininghaus;Hans-Peter Seidel;Olga Sorkine-Hornung;Tino Weinkauf
1838,-0.09750567244748766,-0.3214950630100402,"Towards Interactive, Intelligent, and Integrated Multimedia Analytics",1,2.0,0,Jan Zahálka;Marcel Worring
1839,-0.3038100432534147,-0.09749706259231732,LoyalTracker: Visualizing Loyalty Dynamics in Search Engines,0,1.0,1,Conglei Shi;Yingcai Wu;Shixia Liu;Hong Zhou;Huamin Qu
1840,0.2269692905496856,0.25147930336465996,Distribution Driven Extraction and Tracking of Features for Time-varying Data Analysis,0,1.0,0,Soumya Dutta;Han-Wei Shen
1841,-0.3403265585148682,0.3188333488209075,Visualizing Dimension Coverage to Support Exploratory Analysis,0,1.0,0,Ali Sarvghad;Melanie Tory;Narges Mahyar
1842,-0.31967072717015943,0.22263815414155197,Visual Analytics for Mobile Eye Tracking,0,1.0,0,Kuno Kurzhals;Marcel Hlawatsch;Christof Seeger;Daniel Weiskopf
1843,-0.3358182105277821,-0.09382851457862414,VisTiles: Coordinating and Combining Co-located Mobile Devices for Visual Data Exploration,0,2.0,0,Ricardo Langner;Tom Horak;Raimund Dachselt
1844,-0.2524168521737927,-0.202975515319226,Orko: Facilitating Multimodal Interaction for Visual Exploration and Analysis of Networks,0,2.0,0,Arjun Srinivasan;John Stasko
1845,0.14708098281261367,-0.11702253693977047,Instant Construction and Visualization of Crowded Biological Environments,0,1.0,1,Tobias Klein;Ludovic Autin;Barbora Kozlíková;David S. Goodsell;Arthur Olson;M. Eduard Gröller;Ivan Viola
1846,-0.17340284981081167,0.08679123806532023,Clustering Trajectories by Relevant Parts for Air Traffic Analysis,0,2.0,0,Gennady Andrienko;Natalia Andrienko;Georg Fuchs;Jose Manuel Cordero Garcia
1847,-0.3783431028950736,0.3076213537742652,Voila: Visual Anomaly Detection and Monitoring with Streaming Spatiotemporal Data,0,2.0,0,Nan Cao;Chaoguang Lin;Qiuhan Zhu;Yu-Ru Lin;Xian Teng;Xidao Wen
1848,0.10207831288918655,-0.32070502316655963,Progressive Learning of Topic Modeling Parameters: A Visual Analytics Framework,0,1.0,1,Mennatallah El-Assady;Rita Sevastjanova;Fabian Sperrle;Daniel Keim;Christopher Collins
1849,-0.02167163268734887,-0.35170332041688745,GAN Lab: Understanding Complex Deep Generative Models using Interactive Visual Experimentation,0,1.0,0,Minsuk Kahng;Nikhil Thorat;Duen Horng (Polo) Chau;Fernanda B. Viégas;Martin Wattenberg
1850,-0.10966637949345114,-0.4583890920814036,RuleMatrix: Visualizing and Understanding Classifiers with Rules,0,1.0,0,Yao Ming;Huamin Qu;Enrico Bertini
1851,-0.15350333183806675,-0.013233853433063804,Evaluating Multi-Dimensional Visualizations for Understanding Fuzzy Clusters,0,2.0,0,Ying Zhao;Feng Luo;Minghui Chen;Yingchao Wang;Jiazhi Xia;Fangfang Zhou;Yunhai Wang;Yi Chen;Wei Chen
1852,0.5055886580346064,-0.2741827116918617,"Spline-based color sequences for univariate, bivariate and trivariate mapping",1,0.0,0,B. Pham
1853,0.18155818787068084,-0.04135952840220776,NetV: an experimental network-based volume visualization system,1,0.0,0,T.T. Elvins;D.R. Nadeau
1854,-0.3308127171673127,0.1525732290409605,Bridging the gap between visualization and data management: A simple visualization management system,1,0.0,0,P. Kochevar;Z. Ahmed;J. Shade;C. Sharp
1855,0.187275411412222,0.0864998825077077,Fine-grain visualization algorithms in dataflow environments,1,0.0,0,D. Song;E. Golin
1856,-0.09854411786398871,-0.15143550613710985,"Towards interactive steering, visualization and animation of unsteady finite element simulations",1,0.0,0,G.D. Kerlick;E. Kirby
1857,0.18522676254881196,-0.3490568386151496,3D simulation of delivery,1,0.0,0,J.-D. Boissonnat;B. Geiger
1858,0.23393686598622151,-0.17133344311159648,Parallel performance measures for volume ray casting,1,0.0,0,C.T. Silva;A.E. Kaufman
1859,0.2536443399097242,0.04947830533257353,Virtual reality performance for virtual geometry,1,0.0,0,R.A. Cross;A.J. Hanson
1860,-0.07140632244480703,-0.26107408923434366,Clinical evaluation of interactive volume visualization,1,0.0,0,K.J. Zuiderveld;P.M.A. van Ooijen;J.W.C. Chin-A-Woeng;P.C. Buijs;M. Olree;F.H. Posti
1861,-0.03084842728358142,-0.24981596059989516,Adaptive information visualization based on the user's multiple viewpoints - interactive 3D visualization of the WWW,1,0.0,0,T. Teraoka;M. Maruyama
1862,0.1438682155052773,-0.0038646355102488717,Brushing techniques for exploring volume datasets,1,0.0,0,Pak Chung Wong;R.D. Bergeron
1863,-0.11315439792009663,0.05335744603785206,Traversal-based visualization of data structures,1,0.0,0,J.L. Korn;A.W. Appel
1864,0.2041930445636456,-0.28783743086686153,Wavelets over curvilinear grids,1,0.0,0,G.M. Nielson;Il.-H. Jung;J. Sung
1865,-0.03454320697282344,-0.1308741764210847,Visual presentation of magnetic resonance images,1,0.0,0,J.E. van der Heyden;M.S.T. Carpendale;K. Inkpen;M.S. Atkins
1866,-0.3753866199859576,0.27397279961220655,Domain analysis: a technique to design a user-centered visualization framework,1,0.0,0,O.J. Espinosa;C. Hendrickson;J.H. Garrett
1867,0.13575642779907407,-0.10992632675823881,Graph sketches,1,0.0,0,J. Abello;I. Finocchi;J. Korn
1868,0.38545212677431834,-0.14204780389386615,Transport and anisotropic diffusion in time-dependent flow visualization,1,0.0,0,D. Burkle;T. Preusser;M. Rumpf
1869,0.5125875369943302,0.11467529477392412,Volume Rendering of Fine Details Within Medical Data,1,0.0,0,Feng Dong;G.J. Clapworthy;M. Krokos
1870,0.4588615719299264,-0.07548266545154433,Volumetric shadows using splatting,1,0.0,0,Caixia Zhang;R. Crawfis
1871,0.06432861787053508,0.36340081103248684,A virtual workspace for hybrid multidimensional scaling algorithms,1,0.0,0,G. Ross;M. Chalmers
1872,0.1320886621001192,0.05703199470162229,Pixel-exact rendering of spacetime finite element solutions,1,1.0,0,Yuan Zhou;M. Garland;R. Haber
1873,0.5006719091417129,0.06840032739716152,Rendering implicit flow volumes,1,1.0,0,D. Xue;C. Zhang;R. Crawfis
1874,0.18318403875588582,-0.09667093272845853,2D asymmetric tensor analysis,1,0.0,0,X. Zheng;A. Pang
