,0,1,title,paper_type,cite_number,award,names
0,-0.10619712620472757,0.15084255002069208,D³ Data-Driven Documents,0,1.0,0,Michael Bostock;Vadim Ogievetsky;Jeffrey Heer
1,0.10567001256480138,-0.09882428445873259,Tree-maps: a space-filling approach to the visualization of hierarchical information structures,1,0.0,0,B. Johnson;B. Shneiderman
2,0.12544937541390735,-0.12478338079848786,Parallel coordinates: a tool for visualizing multi-dimensional geometry,1,1.0,0,A. Inselberg;B. Dimsdale
3,0.0353636241377144,0.016613766003982892,Hierarchical Edge Bundles: Visualization of Adjacency Relations in Hierarchical Data,0,1.0,1,Danny Holten
4,0.2882978217940199,0.007166725750134056,ROAMing terrain: Real-time Optimally Adapting Meshes,1,0.0,0,M. Duchaineau;M. Wolinsky;D.E. Sigeti;M.C. Miller;C. Aldrich;M.B. Mineev-Weinstein
5,0.23330718971437278,0.2716962074618031,Acceleration techniques for GPU-based volume rendering,1,0.0,1,J. Kruger;R. Westermann
6,0.6262981521211511,-0.1728654369338298,Efficient simplification of point-sampled surfaces,1,1.0,0,M. Pauly;M. Gross;L.P. Kobbelt
7,-0.2331543510428568,-0.28209142113896085,Vizster: visualizing online social networks,1,0.0,0,J. Heer;D. Boyd
8,0.41731316690194453,-0.032100358264299474,Point set surfaces,1,1.0,0,M. Alexa;J. Behr;D. Cohen-Or;S. Fleishman;D. Levin;C.T. Silva
9,-0.40751207148304663,-0.11348069415956516,ManyEyes: a Site for Visualization at Internet Scale,0,1.0,1,Fernanda B. Viegas;Martin Wattenberg;Frank van Ham;Jesse Kriss;Matt McKeon
10,-0.07515362889385925,-0.10411816912990572,Visualizing the non-visual: spatial analysis and interaction with information from text documents,1,0.0,1,J.A. Wise;J.J. Thomas;K. Pennock;D. Lantrip;M. Pottier;A. Schur;V. Crow
11,-0.10344288540732277,-0.22584151954324283,Toward a Deeper Understanding of the Role of Interaction in Information Visualization,0,2.0,0,Ji Soo Yi;Youn ah Kang;John Stasko
12,-0.2637178619897582,0.12197557192913815,"Polaris: a system for query, analysis and visualization of multi-dimensional relational databases",1,0.0,1,C. Stolte;P. Hanrahan
13,0.31604247365963806,0.0411981519339634,Smooth view-dependent level-of-detail control and its application to terrain rendering,1,0.0,0,H. Hoppe
14,0.5374468011717256,0.030391118311762517,The asymptotic decider: resolving the ambiguity in marching cubes,1,0.0,0,G.M. Nielson;B. Hamann
15,-0.3124218072677986,-0.009855967382401062,Narrative Visualization: Telling Stories with Data,0,0.0,1,Edward Segel;Jeffrey Heer
16,0.5121640407670977,-0.30829620725401363,Simplifying surfaces with color and texture using quadric error metrics,1,0.0,0,M. Garland;P.S. Heckbert
17,-0.055996362257305796,-0.16178000232311227,A Nested Model for Visualization Design and Validation,0,2.0,1,Tamara Munzner
18,-0.3140378934483051,0.37646950752748126,XmdvTool: integrating multiple methods for visualizing multivariate data,1,0.0,0,M.O. Ward
19,-0.07954994071891953,0.025338020830358566,A taxonomy of visualization techniques using the data state reference model,1,0.0,0,E.H. Chi
20,-0.17771126495597203,0.048362445539832544,NodeTrix: a Hybrid Visualization of Social Networks,0,1.0,0,Nathalie Henry;Jean-Daniel Fekete;Michael J. McGuffin
21,-0.21332611335266305,0.2525718449151555,Hierarchical parallel coordinates for exploration of large datasets,1,1.0,0,Ying-Huey Fua;M.O. Ward;E.A. Rundensteiner
22,-0.1796279620003575,-0.29023745778189813,Jigsaw: Supporting Investigative Analysis through Interactive Visualization,1,0.0,1,John Stasko;Carsten Gorg;Zhicheng Liu;Kanupriya Singhal
23,0.2998035051489947,0.22204174863741694,Interactive volume rendering using multi-dimensional transfer functions and direct manipulation widgets,1,1.0,1,J. Kniss;G. Kindlmann;C. Hansen
24,-0.019086349649448633,0.13103351176583794,UpSet: Visualization of Intersecting Sets,0,0.0,0,Alexander Lex;Nils Gehlenborg;Hendrik Strobelt;Romain Vuillemot;Hanspeter Pfister
25,-0.3825937014387676,-0.16092215438001523,Low-level components of analytic activity in information visualization,1,0.0,0,R. Amar;J. Eagan;J. Stasko
26,0.044589259006617754,-0.09064205122027649,ThemeRiver: visualizing theme changes over time,1,0.0,0,S. Havre;B. Hetzler;L. Nowell
27,0.3797735907888997,0.15936029709135277,Curvature-based transfer functions for direct volume rendering: methods and applications,1,1.0,0,G. Kindlmann;R. Whitaker;T. Tasdizen;T. Moller
28,-0.10904209009228467,-0.2071180876097025,"Focus+context display and navigation techniques for enhancing radial, space-filling hierarchy visualizations",1,0.0,0,J. Stasko;E. Zhang
29,0.07744368532959195,0.3480876089344272,Cluster and calendar based visualization of time series data,1,0.0,1,J.J. Van Wijk;E.R. Van Selow
30,0.3127905401826902,0.10704693234255933,New quadric metric for simplifying meshes with appearance attributes,1,0.0,0,H. Hoppe
31,0.2055919707251158,-0.2510343015363259,Multi-projector displays using camera-based registration,1,0.0,0,R. Raskar;M.S. Brown;Ruigang Yang;Wei-Chao Chen;G. Welch;H. Towles;B. Scales;H. Fuchs
32,0.12617664845398435,0.16747741182911707,A haptic interaction method for volume visualization,1,0.0,0,R.S. Avila;L.M. Sobierajski
33,0.002134613442906007,-0.23733475446783134,"SpaceTree: supporting exploration in large node link tree, design evolution and empirical evaluation",1,0.0,0,C. Plaisant;J. Grosjean;B.B. Bederson
34,-0.30372594492227617,0.17402161495709562,Animated Transitions in Statistical Data Graphics,0,0.0,0,Jeffrey Heer;George Robertson
35,-0.053815320688736124,0.048133651137627465,Rolling the Dice: Multidimensional Visual Exploration using Scatterplot Matrix Navigation,0,1.0,1,Niklas Elmqvist;Pierre Dragicevic;Jean-Daniel Fekete
36,0.2485917763129138,-0.17733861585991167,Large scale terrain visualization using the restricted quadtree triangulation,1,0.0,0,R. Pajarola
37,0.2433655137384959,-0.11048672228446403,Dynamic view-dependent simplification for polygonal models,1,0.0,0,J.C. Xia;A. Varshney
38,0.08981989386393162,0.04693532732811582,Ambient Occlusion and Edge Cueing for Enhancing Real Time Molecular Visualization,0,1.0,0,Marco Tarini;Paolo Cignoni;Claudio Montani
39,-0.1008459438850477,-0.3219743646133435,Design Study Methodology: Reflections from the Trenches and the Stacks,0,2.0,1,Michael Sedlmair;Miriah Meyer;Tamara Munzner
40,-0.22203529870075475,-0.00955216154037914,Visual Exploration of Big Spatio-Temporal Urban Data: A Study of New York City Taxi Trips,0,1.0,0,Nivan Ferreira;Jorge Poco;Huy T. Vo;Juliana Freire;Cláudio T. Silva
41,0.2542183872770943,-0.0002657882568151286,Interactive ray tracing for isosurface rendering,1,0.0,1,S. Parker;P. Shirley;Y. Livnat;C. Hansen;P.-P. Sloan
42,-0.13142434790699029,-0.2882442444420934,Show Me: Automatic Presentation for Visual Analysis,0,0.0,0,Jock Mackinlay;Pat Hanrahan;Chris Stolte
43,0.13075310891383654,0.05621414443444419,H3: laying out large directed graphs in 3D hyperbolic space,1,0.0,0,T. Munzner
44,0.49649883134708306,-0.15793704768768718,Anisotropic geometric diffusion in surface processing,1,0.0,0,U. Clarenz;U. Diewald;M. Rumpf
45,-0.17466264280238705,-0.2932097768089589,The structure of the information visualization design space,1,0.0,1,S.K. Card;J. Mackinlay
46,0.31885610354122623,-0.29225734864486913,Fast and memory efficient polygonal simplification,1,0.0,0,P. Lindstrom;G. Turk
47,0.02431963660542775,-0.22236033724247112,Participatory Visualization with Wordle,0,0.0,0,Fernanda B. Viegas;Martin Wattenberg;Jonathan Feinberg
48,0.13575642779907407,-0.10992632675823881,Visualizing time-series on spirals,1,0.0,0,M. Weber;M. Alexa;W. Muller
49,-0.08648516290735375,0.46792849264091324,A Taxonomy of Clutter Reduction for Information Visualisation,0,2.0,0,Geoffrey Ellis;Alan Dix
50,0.07064585219437271,-0.14372234655555674,A Comparison of the Readability of Graphs Using Node-Link and Matrix-Based Representations,1,0.0,0,M. Ghoniem;J.-D. Fekete;P. Castagliola
51,0.01040030631069971,-0.012884874768884986,The contour spectrum,1,0.0,0,C.L. Bajaj;V. Pascucci;D.R. Schikore
52,-0.2765023576255719,-0.3004037613570953,VisTrails: enabling interactive multiple-view visualizations,1,1.0,0,L. Bavoil;S.P. Callahan;P.J. Crossno;J. Freire;C.E. Scheidegger;C.T. Silva;H.T. Vo
53,-0.1342085013787409,-0.14143791098250963,Network Visualization by Semantic Substrates,0,1.0,0,Ben Shneiderman;Aleks Aris
54,0.07315235548696343,0.1382736469556827,Stacked Graphs - Geometry & Aesthetics,0,0.0,1,Lee Byron;Martin Wattenberg
55,-0.28587922798304694,0.308927847602481,Application-controlled demand paging for out-of-core visualization,1,0.0,0,M. Cox;D. Ellsworth
56,-0.014461043939664355,-0.10291322522221068,A problem-oriented classification of visualization techniques,1,0.0,0,S. Wehrend;C. Lewis
57,-0.16491850380494227,0.12803690919716876,The InfoVis Toolkit,1,0.0,0,J.-D. Fekete
58,-0.2887114811431522,-0.42543930769973265,Casual Information Visualization: Depictions of Data in Everyday Life,0,1.0,0,Zachary Pousman;John Stasko;Michael Mateas
59,0.22637912901037852,-0.0977239073616207,An evaluation of reconstruction filters for volume rendering,1,0.0,1,S.R. Marschner;R.J. Lobb
60,0.09551698657777734,-0.13643584329320124,SensePlace2: GeoTwitter analytics support for situational awareness,1,1.0,0,Alan M. MacEachren;Anuj Jaiswal;Anthony C. Robinson;Scott Pezanowski;Alexander Savelyev;Prasenjit Mitra;Xiao Zhang;Justine Blanford
61,0.02175374811995414,-0.23290910122333824,The value of visualization,1,1.0,1,J.J. van Wijk
62,-0.3600637173411083,0.04832100580997707,TextFlow: Towards Better Understanding of Evolving Topics in Text,0,1.0,0,Weiwei Cui;Shixia Liu;Li Tan;Conglei Shi;Yangqiu Song;Zekai Gao;Huamin Qu;Xin Tong
63,0.3569983119354482,0.04934722513095385,Volume illustration: non-photorealistic rendering of volume models,1,1.0,1,D. Ebert;P. Rheingans
64,-0.20830828311859104,0.1965181094162622,Interactive data visualization using focusing and linking,1,1.0,0,A. Buja;J.A. McDonald;J. Michalak;W. Stuetzle
65,-0.24306935908013352,0.053961848753681936,Clutter Reduction in Multi-Dimensional Data Visualization Using Dimension Reordering,1,0.0,0,Wei Peng;M.O. Ward;E.A. Rundensteiner
66,-0.20446192300961383,0.2182824716048938,Effectiveness of Animation in Trend Visualization,0,0.0,1,George Robertson;Roland Fernandez;Danyel Fisher;Bongshin Lee;John Stasko
67,-0.38729592883128633,-0.19665573809915468,Protovis: A Graphical Toolkit for Visualization,0,1.0,0,Michael Bostock;Jeffrey Heer
68,-0.3544194267389915,-0.28577663376471035,A Multi-Level Typology of Abstract Visualization Tasks,0,2.0,0,Matthew Brehmer;Tamara Munzner
69,-0.2767187259386107,0.3235414135598177,Exploring N-dimensional databases,1,0.0,0,J. LeBlanc;M.O. Ward;N. Wittels
70,0.15055870001264443,0.4458923632850967,Visualization of large terrains made easy,1,0.0,0,P. Lindstrom;V. Pascucci
71,0.16716734819461965,-0.023332148979132182,Geometry-Based Edge Clustering for Graph Visualization,0,0.0,0,Weiwei Cui;Hong Zhou;Huamin Qu;Pak Chung Wong;Xiaoming Li
72,0.31201029633075844,-0.17292869113339623,Cushion treemaps: visualization of hierarchical information,1,0.0,0,J.J. Van Wijk;H. Van de Wetering
73,-0.08083453698485925,-0.21514111559595941,"The Word Tree, an Interactive Visual Concordance",0,0.0,0,Martin Wattenberg;Fernanda B. Viégas
74,0.2800547417360381,-0.17527540301119324,Optimizing triangle strips for fast rendering,1,0.0,0,F. Evans;S. Skiena;A. Varshney
75,-0.42405489332189206,-0.40441616134828245,Design Considerations for Collaborative Visual Analytics,1,2.0,0,Jeffrey Heer;Maneesh Agrawala
76,0.13575642779907407,-0.10992632675823881,High Dimensional Brushing for Interactive Exploration of Multivariate Data,1,0.0,1,A.R. Martin;M.O. Ward
77,0.036640673577095946,0.07216398343048816,Similarity clustering of dimensions for an enhanced visualization of multidimensional data,1,1.0,0,M. Ankerst;S. Berchtold;D.A. Keim
78,0.13575642779907407,-0.10992632675823881,Animated exploration of dynamic graphs with radial layout,1,0.0,0,Ka-Ping Yee;D. Fisher;R. Dhamija;M. Hearst
79,0.17584972322240494,0.40347765800545204,Flow map layout,1,0.0,0,Doantam Phan;Ling Xiao;R. Yeh;P. Hanrahan
80,0.5403861262853941,-0.09413511776409623,Geometric surface smoothing via anisotropic diffusion of normals,1,1.0,0,T. Tasdizen;R. Whitaker;P. Burchard;S. Osher
81,-0.1194385433994445,0.4438352912255708,Recursive pattern: a technique for visualizing very large amounts of data,1,1.0,0,D.A. Keim;H.-P. Kriegel;M. Ankerst
82,0.24443497392314886,0.4581935515475223,Multiresolution Techniques for Interactive Texture-based Volume Visualization,1,0.0,0,E. LaMar;B. Hamann;K.I. Joy
83,0.36364263239413386,-0.016314598684293205,Techniques for non-linear magnification transformations,1,0.0,0,T.A. Keahey;E.L. Robertson
84,0.42377518601069997,-0.18883807573146813,A tool for visualizing the topology of three-dimensional vector fields,1,1.0,0,A. Globus;C. Levit;T. Lasinski
85,-0.12338397863688388,0.4345766836904733,DNA visual and analytic data mining,1,0.0,0,P. Hoffman;G. Grinstein;K. Marx;I. Grosse;E. Stanley
86,-0.17186944324207268,0.6414836161086285,Fast and Efficient Compression of Floating-Point Data,0,1.0,0,Peter Lindstrom;Martin Isenburg
87,0.12021508075911552,0.07033294140176873,Optimized geometry compression for real-time rendering,1,0.0,0,M.M. Chow
88,-0.0773437698969075,-0.2815006787958395,ASK-graphView: a large scale graph visualization system,0,0.0,0,James Abello;Frank Van Ham;Neeraj Krishnan
89,-0.2709553109706038,-0.34674439486092073,MatrixExplorer: a Dual-Representation System to Explore Social Networks,0,1.0,0,Nathalie Henry;Jean-daniel Fekete
90,0.0398080316666308,-0.0701368559093951,Interactive information visualization of a million items,1,0.0,0,J.-D. Fekete;C. Plaisant
91,0.5492597158948592,-0.07087609412489174,Octree-based decimation of marching cubes surfaces,1,0.0,0,R. Shekhar;E. Fayyad;R. Yagel;J.F. Cornhill
92,-0.34144245989273736,-0.24307417301534395,"Graphical Histories for Visualization: Supporting Analysis, Communication, and Evaluation",0,1.0,0,Jeffrey Heer;Jock Mackinlay;Chris Stolte;Maneesh Agrawala
93,0.00925660663392726,-0.21848851546431464,Generation of Transfer Functions with Stochastic Search Technique,1,0.0,0,Taosong He;Lichan Hong;A. Kaufman;H. Pfister
94,-0.07032671701547487,0.36455893293999525,Bubble Sets: Revealing Set Relations with Isocontours over Existing Visualizations,0,0.0,0,Christopher Collins;Gerald Penn;Sheelagh Carpendale
95,0.34420914022119453,-0.082718366263731,Tensorlines: Advection-Diffusion based Propagation through Diffusion Tensor Fields,1,0.0,0,D. Weinstein;G. Kindlmann;E. Lundberg
96,-0.1900605855265761,-0.20160117526639446,The Design and Implementation of an Object-Oriented Toolkit for 3D Graphics and Visualization,1,0.0,0,W.J. Schroeder;K.M. Martin;W.E. Lorensen
97,0.5145342688883426,-0.1566157250737484,Mesh reduction with error control,1,0.0,0,R. Klein;G. Liebich;W. Strasser
98,-0.35810801907534545,0.1598729544478163,Enterprise Data Analysis and Visualization: An Interview Study,0,1.0,1,Sean Kandel;Andreas Paepcke;Joseph M. Hellerstein;Jeffrey Heer
99,0.6044289139180478,-0.10740332272051893,Constructing stream surfaces in steady 3D vector fields,1,0.0,0,J.P.M. Hultquist
100,0.10508478927226818,0.28861375879534046,Choosing effective colours for data visualization,1,0.0,0,C.G. Healey
101,0.46682983426634644,-0.24390426707174578,Evolutionary morphing,1,0.0,0,D.F. Wiley;N. Amenta;D.A. Alcantara;D. Ghosh;Y.J. Kil;E. Delson;W. Harcourt-Smith;F.J. Rohlf;K. St John;B. Hamann
102,0.01976143151981533,0.18491247692299032,Arc diagrams: visualizing structure in strings,1,0.0,0,M. Wattenberg
103,0.13575642779907407,-0.10992632675823881,Ordered treemap layouts,1,0.0,0,B. Shneiderman;M. Wattenberg
104,-0.2985821129106078,-0.32996864654023605,IVEE: an Information Visualization and Exploration Environment,1,0.0,0,C. Ahlberg;E. Wistrand
105,0.001074153446042291,0.21085437167880833,Parallel Tag Clouds to explore and analyze faceted text corpora,1,1.0,1,Christopher Collins;Fernanda B. Viegas;Martin Wattenberg
106,-0.08366835941327261,-0.09754584164468395,Multidimensional detective,1,0.0,0,A. Inselberg
107,-0.04711104480650564,-0.3849892565508607,PixelFlex: a reconfigurable multi-projector display system,1,1.0,0,Ruigang Yang;D. Gotz;J. Hensley;H. Towles;M.S. Brown
108,-0.25652593050310185,0.3775947471176363,Angular brushing of extended parallel coordinates,1,0.0,0,H. Hauser;F. Ledermann;H. Doleisch
109,0.1531816564836056,0.4529302593002093,Interactive rendering of large volume data sets,1,1.0,0,S. Guthe;M. Wand;J. Gonser;W. Strasser
110,0.36075829175631113,-0.2109606523911441,Virtualized reality: constructing time-varying virtual worlds from real world events,1,0.0,0,P. Rander;P.J. Narayanan;T. Kanade
111,0.13575642779907407,-0.10992632675823881,Progressive Compression of Arbitrary Triangular Meshes,1,1.0,0,
112,-0.3739374272375487,0.03298591681583446,Scented Widgets: Improving Navigation Cues with Embedded Visualizations,0,0.0,0,Wesley Willett;Jeffrey Heer;Maneesh Agrawala
113,0.35622753521060824,-0.034224427085250315,Bounded-distortion piecewise mesh parameterization,1,0.0,0,O. Sorkine;D. Cohen-Or;R. Goldenthal;D. Lischinski
114,-0.2757836209512279,-0.09872463694999031,What Makes a Visualization Memorable?,0,1.0,0,Michelle A. Borkin;Azalea A. Vo;Zoya Bylinskii;Phillip Isola;Shashank Sunkavalli;Aude Oliva;Hanspeter Pfister
115,0.2775460600184558,-0.0450395556093695,CPR - curved planar reformation,1,0.0,0,A. Kanitsar;D. Fleischmann;R. Wegenkittl;P. Felkel;E. Groller
116,-0.13076530927325208,-0.3811382104589675,Multiscale Visualization of Small World Networks,1,0.0,0,D. Auber;Y. Chiricota;F. Jourdan;G. Melancon
117,-0.09915202396048708,-0.2183780735056799,Balancing Systematic and Flexible Exploration of Social Networks,0,1.0,0,Adam Perer;Ben Shneiderman
118,0.013336205393418937,0.05129078338646767,Importance-Driven Focus of Attention,0,0.0,0,Ivan Viola;Miquel Feixas;Mateu Sbert;Meister Eduard Groller
119,-0.116808792799094,0.11275751325646538,Interactive Visual Exploration of a Large Spatio-temporal Dataset: Reflections on a Geovisualization Mashup.,0,1.0,0,Jo Wood;Jason Dykes;Aidan Slingsby;Keith Clarke
120,0.288562026876218,-0.014740090556522522,Graph-theoretic scagnostics,1,1.0,0,L. Wilkinson;A. Anand;R. Grossman
121,-0.3280558726172451,-0.05703825090662365,A rule-based tool for assisting colormap selection,1,0.0,0,L.D. Bergman;B.E. Rogowitz;L.A. Treinish
122,0.18794259077601433,0.18563463213148396,VolumeShop: an interactive system for direct volume illustration,1,0.0,0,S. Bruckner;M.E. Groller
123,0.01219908208156751,-0.20354046178981636,Rethinking Visualization: A High-Level Taxonomy,1,0.0,0,M. Tory;T. Moller
124,-0.1970809321782595,-0.11923438508947352,An operator interaction framework for visualization systems,1,1.0,1,Ed Huai-Hsin Chi;J.T. Riedl
125,-0.2741025331668174,-0.11666317554622527,Does animation help users build mental maps of spatial information?,1,0.0,0,B.B. Bederson;A. Boltman
126,0.2849886544439693,0.2815420143740522,Nonlinear magnification fields,1,0.0,0,T.A. Keahey;E.L. Robertson
127,0.08682729131973979,0.21419127579183225,Importance-driven volume rendering,1,0.0,0,I. Viola;A. Kanitsar;M.E. Groller
128,-0.1857618104992754,-0.08867884732426719,A Visual Backchannel for Large-Scale Events,0,1.0,0,Marian Dörk;Daniel Gruen;Carey Williamson;Sheelagh Carpendale
129,0.13475587930709362,0.3865803436440687,A linear iteration time layout algorithm for visualising high-dimensional data,1,0.0,0,M. Chalmers
130,-0.4174991092810528,-0.19897367537701144,Building Highly-Coordinated Visualizations in Improvise,1,0.0,0,C. Weaver
131,-0.10321775961153498,0.05305347813200945,Virtual GIS: a real-time 3D geographic information system,1,0.0,0,D. Koller;P. Lindstrom;W. Ribarsky;L.F. Hodges;N. Faust;G. Turner
132,0.27778338865410346,-0.17986655764344994,Scalable alignment of large-format multi-projector displays using camera homography trees,1,0.0,0,Han Chen;R. Sukthankar;G. Wallace;Kai Li
133,-0.27263920063619973,-0.2999813696741463,Diamonds in the rough: Social media visual analytics for journalistic inquiry,1,0.0,0,Nicholas Diakopoulos;Mor Naaman;Funda Kivran-Swaine
134,0.08940709669812187,-0.09948311046818262,Noodles: A Tool for Visualization of Numerical Weather Model Ensemble Uncertainty,0,2.0,0,Jibonananda Sanyal;Song Zhang;Jamie Dyer;Andrew Mercer;Philip Amburn;Robert Moorhead
135,0.33662839797163135,-0.1103624464409251,Interactive visualization of 3D-vector fields using illuminated stream lines,1,0.0,1,M. Zockler;D. Stalling;H.-C. Hege
136,-0.2230251542541645,-0.2831061566553028,Visual Traffic Jam Analysis Based on Trajectory Data,0,2.0,0,Zuchao Wang;Min Lu;Xiaoru Yuan;Junping Zhang;Huub van de Wetering
137,-0.143937022853883,-0.21640059674036394,Software Design Patterns for Information Visualization,0,0.0,0,Jeffrey Heer;Maneesh Agrawala
138,-0.18079898182167292,-0.3613496675178476,"""Search, Show Context, Expand on Demand"": Supporting Large Graph Exploration with Degree-of-Interest",0,0.0,0,Frank van Ham;Adam Perer
139,-0.2659227111360575,0.20971707545158905,Outlier-Preserving Focus+Context Visualization in Parallel Coordinates,0,0.0,0,Matej Novotny;Helwig Hauser
140,-0.09190722758851948,-0.2403052317008944,A distributed graphics system for large tiled displays,1,0.0,0,G. Humphreys;P. Hanrahan
141,-0.1744110785346128,0.06066292439895552,Stacking-Based Visualization of Trajectory Attribute Data,0,1.0,0,Christian Tominski;Heidrun Schumann;Gennady Andrienko;Natalia Andrienko
142,0.34155851997686576,0.316664487385574,A fast volume rendering algorithm for time-varying fields using a time-space partitioning (TSP) tree,1,0.0,0,H.-W. Shen;L.-J. Chiang;K.-L. Ma
143,-0.22276389968535076,0.2703355608991204,A contract based system for large data visualization,1,0.0,0,H. Childs;E. Brugger;K. Bonnell;J. Meredith;M. Miller;B. Whitlock;N. Max
144,-0.02284757905010568,-0.12395757071369187,VisLink: Revealing Relationships Amongst Visualizations,0,0.0,0,Christopher Collins;Sheelagh Carpendale
145,-0.09573188492710982,0.3740267112581339,Interactive visual clustering of large collections of trajectories,1,0.0,0,Gennady Andrienko;Natalia Andrienko;Salvatore Rinzivillo;Mirco Nanni;Dino Pedreschi;Fosca Giannotti
146,-0.3617141705141425,-0.0992890921199056,Visage: a user interface environment for exploring information,1,0.0,1,S.F. Roth;P. Lucas;J.A. Senn;C.C. Gomberg;M.B. Burks;P.J. Stroffolino;A.J. Kolojechick;C. Dunmire
147,0.5459475285772708,-0.06498630878399031,"The ""Parallel Vectors"" operator-a vector field visualization primitive",1,0.0,0,R. Peikert;M. Roth
148,0.555233670717029,0.07635857066646229,Hardware-accelerated volume and isosurface rendering based on cell-projection,1,1.0,0,S. Rottger;M. Kraus;T. Ertl
149,0.23283737866593368,-0.14663744818160968,Interactive Visualization of Small World Graphs,1,1.0,0,F. van Ham;J.J. van Wijk
150,-0.12314214771737216,0.22023886496671025,Using deformations for browsing volumetric data,1,0.0,0,M.J. McGuffin;L. Tancau;R. Balakrishnan
151,-0.012041359548387056,0.23604013839670282,Flow Mapping and Multivariate Visualization of Large Spatial Interaction Data,0,1.0,0,Diansheng Guo
152,-0.07867534914928931,0.4402333821507344,Spatiotemporal social media analytics for abnormal event detection and examination using seasonal-trend decomposition,1,1.0,0,Junghoon Chae;Dennis Thom;Harald Bosch;Yun Jang;Ross Maciejewski;David S. Ebert;Thomas Ertl
153,-0.0782149876207038,-0.1049014274399772,The information mural: a technique for displaying and navigating large information spaces,1,0.0,0,D.F. Jerding;J.T. Stasko
154,-0.03283409099837406,-0.06916139125526186,GeoTime Information Visualization,1,0.0,0,T. Kapler;W. Wright
155,0.31393143356149966,0.15124301721225747,Streaming meshes,1,0.0,0,M. Isenburg;P. Lindstrom
156,-0.20281985869878796,-0.03745245072412478,VisGets: Coordinated Visualizations for Web-based Information Exploration and Discovery,0,1.0,0,Marian Dörk;Sheelagh Carpendale;Christopher Collins;Carey Williamson
157,-0.3609013185308218,-0.06687642008011471,Voyager: Exploratory Analysis via Faceted Browsing of Visualization Recommendations,0,1.0,0,Kanit Wongsuphasawat;Dominik Moritz;Anushka Anand;Jock Mackinlay;Bill Howe;Jeffrey Heer
158,0.10843191723153014,-0.11138559048218373,The virtual windtunnel: An environment for the exploration of three-dimensional unsteady flows,1,0.0,1,S. Bryson;C. Levit
159,0.5001962529606515,-0.04660053628347224,Discretized Marching Cubes,1,0.0,0,C. Montani;R. Scateni;R. Scopigno
160,0.4089696717513729,0.16252697053363585,Isosurfacing in span space with utmost efficiency (ISSUE),1,0.0,0,Han-Wei Shen;C.D. Hansen;Y. Livnat;C.R. Johnson
161,-0.3175352700041448,-0.21843733353181197,Visualization Rhetoric: Framing Effects in Narrative Visualization,0,2.0,0,Jessica Hullman;Nick Diakopoulos
162,0.18913149863422823,0.30495177890597414,High-quality two-level volume rendering of segmented data sets on consumer graphics hardware,1,0.0,0,M. Hadwiger;C. Berger;H. Hauser
163,-0.08040789261572119,0.04649171599982624,Graphical Perception of Multiple Time Series,0,0.0,0,Waqas Javed;Bryan McDonnel;Niklas Elmqvist
164,-0.07078258441834093,0.43486457563757325,Nanocubes for Real-Time Exploration of Spatiotemporal Datasets,0,1.0,1,Lauro Lins;James T. Klosowski;Carlos Scheidegger
165,-0.27472001120415135,0.11935295341853516,Temporal Event Sequence Simplification,0,1.0,1,Megan Monroe;Rongjian Lan;Hanseung Lee;Catherine Plaisant;Ben Shneiderman
166,0.36109338668812907,0.26009867555693594,Simplifying flexible isosurfaces using local geometric measures,1,0.0,1,H. Carr;J. Snoeyink;M. van de Panne
167,-0.08435488302584207,-0.04289265680141936,Quality Metrics in High-Dimensional Data Visualization: An Overview and Systematization,0,2.0,0,Enrico Bertini;Andrada Tatu;Daniel Keim
168,-0.21061706358988225,-0.3266050412315898,InfoCrystal: A visual tool for information retrieval,1,0.0,0,A. Spoerri
