,0,1,title,paper_type,cite_number,award,names
919,-3.0046117,2.423707,Visualizing Network Traffic to Understand the Performance of Massively Parallel Simulations,0,1.0,0,Aaditya G. Landge;Joshua A. Levine;Abhinav Bhatele;Katherine E. Isaacs;Todd Gamblin;Martin Schulz;Steve H. Langer;Peer-Timo Bremer;Valerio Pascucci
920,3.6442397,12.622214,Efficient Structure-Aware Selection Techniques for 3D Point Cloud Visualizations with 2DOF Input,0,1.0,1,Lingyun Yu;Konstantinos Efstathiou;Petra Isenberg;Tobias Isenberg
921,-13.610716,35.42141,Hierarchical Exploration of Volumes Using Multilevel Segmentation of the Intensity-Gradient Histograms,0,1.0,1,Cheuk Yiu Ip;Amitabh Varshney;Joseph JaJa
922,-17.237865,3.527361,Activity Sculptures: Exploring the Impact of Physical Visualizations on Running Activity,0,1.0,0,Simon Stusak;Aurélien Tabard;Franziska Sauka;Rohit Ashok Khot;Andreas Butz
923,-11.982444,5.4503207,Using Topological Analysis to Support Event-Guided Exploration in Urban Data,0,2.0,0,Harish Doraiswamy;Nivan Ferreira;Theodoros Damoulas;Juliana Freire;Cláudio T. Silva
924,-16.661293,-20.620602,Supporting Iterative Cohort Construction with Visual Temporal Queries,0,1.0,0,Josua Krause;Adam Perer;Harry Stavropoulos
925,-14.063485,-15.179102,egoSlider: Visual Analysis of Egocentric Network Evolution,0,2.0,0,Yanhong Wu;Naveen Pitipornvivat;Jian Zhao;Sixiao Yang;Guowei Huang;Huamin Qu
926,39.486095,17.061544,Visualization of turbulent flow with particles,1,0.0,0,A.J.S. Hin;F.H. Post
927,-21.162123,35.136337,Integrated control of distributed volume visualization through the World-Wide-Web,1,0.0,0,C.S. Ang;D.C. Martin;M.D. Doyle
928,16.502424,-41.43201,Distortion viewing techniques for 3-dimensional data,1,0.0,0,M. Sheelagh T. Carpendale;D.J. Cowperthwaite;F.D. Fracchia
929,-2.9282234,11.32873,Animating multidimensional scaling to visualize N-dimensional data sets,2,0.0,0,C.L. Bentley;M.O. Ward
930,-10.177076,34.293415,Integrated volume compression and visualization,1,0.0,0,Tzi-Cker Chiueh;Chuan-Kai Yang;Taosong He;H. Pfister;A. Kaufman
931,-34.850883,-37.258106,"Visualization of Sports using Motion Trajectories: Providing Insights into Performance, Style, and Strategy",1,0.0,0,G. Pingali;A. Opalach;Y. Jean;I. Carlbom
932,11.571423,-35.102116,Visualizing dynamic molecular conformations,1,0.0,0,J. Schmidt-Ehrenberg;D. Baum;H.-C. Hege
933,19.508327,-36.201332,IN-SPIRE InfoVis 2004 Contest Entry,2,0.0,0,Pak Chung Wong;B. Hetzler;C. Posse;M. Whiting;S. Havre;N. Cramer;Anuj Shah;M. Singhal;A. Turner;J. Thomas
934,-3.3874693,2.595241,Value and Relation Display for Interactive Exploration of High Dimensional Datasets,1,0.0,0,Jing Yang;A. Patro;Shiping Huang;N. Mehta;M.O. Ward;E.A. Rundensteiner
935,0.08287279,21.854786,Stream-processing points,1,1.0,0,R. Pajarola
936,13.969546,-3.695216,Visual Analysis of Multivariate State Transition Graphs,0,0.0,0,A. Johannes Pretorius;Jarke J. Van Wijk
937,40.21287,14.380246,Variable Interactions in Query-Driven Visualization,0,0.0,0,Luke Gosink;John Anderson;Wes Bethel;Kenneth Joy
938,-4.4419384,-29.905268,VAST 2008 Challenge: Introducing mini-challenges,2,0.0,0,Georges Grinstein;Catherine Plaisant;Sharon Laskowski;Theresa O'Connell;Jean Scholtz;Mark Whiting
939,-13.366128,40.220753,Interactive Volume Exploration for Feature Detection and Quantification in Industrial CT Data,0,0.0,0,Markus Hadwiger;Fritz Laura;Christof Rezk-Salama;Thomas Höllt;Georg Geier;Thomas Pabel
940,20.03686,-25.159222,Towards the Personal Equation of Interaction: The impact of personality factors on visual analytics interface interaction,1,0.0,0,Tear Marie Green;Brian Fisher
941,-41.832302,4.4659653,BirdVis: Visualizing and Understanding Bird Populations,0,1.0,0,Nivan Ferreira;Lauro Lins;Daniel Fink;Steve Kelling;Christopher Wood;Juliana Freire;Claudio Silva
942,-14.86957,2.6768336,"VisBricks: Multiform Visualization of Large, Inhomogeneous Data",0,1.0,0,Alexander Lex;Hans-Jorg Schulz;Marc Streit;Christian Partl;Dieter Schmalstieg
943,38.270416,22.099642,Load-Balanced Parallel Streamline Generation on Large Scale Vector fields,0,0.0,0,Boonthanome Nouanesengsy;Teng-Yok Lee;Han-Wei Shen
944,11.580341,15.67511,"Just-in-time annotation of clusters, outliers, and trends in point-based data visualizations",1,1.0,0,Eser Kandogan
945,-6.182576,-32.67836,Constructing Visual Representations: Investigating the Use of Tangible Tokens,0,2.0,0,Samuel Huron;Yvonne Jansen;Sheelagh Carpendale
946,16.60845,26.367058,Optimization of time-dependent particle tracing using tetrahedral decomposition,1,0.0,0,D.N. Kenwright;D.A. Lane
947,8.473401,-21.377676,Flow visualization for turbomachinery design,1,0.0,1,M. Roth;R. Peikert
948,15.951779,21.005394,"Time management, simultaneity and time-critical computation in interactive unsteady visualization environments",1,0.0,0,S. Bryson;S. Johan
949,23.020876,15.903952,Wavelets applied to lossless compression and progressive transmission of floating point data in 3-D curvilinear grids,1,0.0,0,A. Trott;R. Moorhead;J. McGinley
950,1.2311729,3.551907,Displaying data in multidimensional relevance space with 2D visualization maps,1,1.0,0,J. Assa;D. Cohen-Or;T. Milo
951,-33.581352,-12.732541,Battlefield visualization on the responsive workbench,1,0.0,0,J. Durbin;J.E. Swan;B. Colbert;J. Crowe;R. King;T. King;C. Scannell;Z. Wartell;T. Welsh
952,21.843105,-10.678816,FastSplats: optimized splatting on rectilinear grids,1,0.0,0,Jian Huang;K. Mueller;N. Shareef;R. Crawfis
953,11.295249,32.25907,TetFusion: an algorithm for rapid tetrahedral mesh simplification,1,0.0,0,P. Chopra;J. Meyer
954,-8.800616,46.021164,Monte Carlo volume rendering,1,1.0,0,B. Csebfalvi;L. Szirmay-Kalos
955,45.933453,27.68473,Display of vector fields using a reaction-diffusion model,1,1.0,0,A.R. Sanderson;C.R. Johnson;R.M. Kirby
956,17.800587,15.970576,Visualization of graphs with associated timeseries data,1,0.0,0,Purvi Saraiya;P. Lee;C. North
957,-18.668938,33.081146,Illustration and photography inspired visualization of flows and volumes,1,1.0,0,N.A. Svakhine;Y. Jang;D. Ebert;K. Gaither
958,-12.970845,-27.721083,Visual Signatures in Video Visualization,0,0.0,0,Min Chen;Ralf Botchen;Rudy Hashim;Daniel Weiskopf;Thomas Ertl;Ian Thornton
959,-16.498825,2.472536,Visualization of Heterogeneous Data,0,1.0,0,Mike Cammarano;Xin Dong;Bryan Chan;Jeff Klingner;Justin Talbot;Alon Halevey;Pat Hanrahan
960,-5.792613,-51.454426,Contextualized Videos: Combining Videos with Environment Models to Support Situational Understanding,0,0.0,0,Yi Wang;David M. Krum;Enylton M. Coelho;Doug A. Bowman
961,2.2034707,2.2571933,LiveSync: Deformed Viewing Spheres for Knowledge-Based Navigation,0,0.0,0,Peter Kohlmann;Stefan Bruckner;Armin Kanitsar;Eduard Gröller
962,15.787798,53.201397,Surface Extraction from Multi-Material Components for Metrology using Dual Energy CT,0,1.0,0,Christoph Heinzl;Johann Kastner;Eduard Gröller
963,-15.449726,47.940685,Perception-Based Transparency Optimization for Direct Volume Rendering,0,0.0,1,Ming-Yuen Chan;Yingcai Wu;Wai-Ho Mak;Wei Chen;Huamin Qu
964,25.41545,-10.730212,Flow-based scatterplots for sensitivity analysis,1,1.0,0,Yu-Hsuan Chan;Carlos D. Correa;Kwan-Liu Ma
965,-21.143307,-23.750742,Drawing Road Networks with Focus Regions,0,1.0,0,Jan-Henrik Haunert;Leon Sering
966,18.44615,-28.221867,Evaluating the Effect of Style in Information Visualization,0,1.0,0,Andrew Vande Moere;Martin Tomitsch;Christoph Wimmer;Boesch Christoph;Thomas Grechenig
967,-4.804343,-16.077358,Representative Factor Generation for the Interactive Visual Analysis of High-Dimensional Data,0,1.0,0,Cagatay Turkay;Arvid Lundervold;Astri Johansen Lundervold;Helwig Hauser
968,-1.6819398,-20.283123,The Persuasive Power of Data Visualization,0,1.0,0,Anshul Vikram Pandey;Anjali Manivannan;Oded Nov;Margaret Satterthwaite;Enrico Bertini
969,3.7054844,-10.534075,"Evaluation of Parallel Coordinates: Overview, Categorization and Guidelines for Future Research",0,1.0,0,Jimmy Johansson;Camilla Forsell
970,-18.106903,26.397741,Do Convolutional Neural Networks Learn Class Hierarchy?,0,2.0,0,Alsallakh Bilal;Amin Jourabloo;Mao Ye;Xiaoming Liu;Liu Ren
971,-32.714268,18.383087,Analyzing the Training Processes of Deep Generative Models,0,2.0,0,Mengchen Liu;Jiaxin Shi;Kelei Cao;Jun Zhu;Shixia Liu
972,-31.922527,9.060289,An architecture for retaining and analyzing visual explorations of databases,1,0.0,0,J.P. Lee;G.G. Grinstein
973,-29.393518,-22.01155,FINESSE: a financial information spreadsheet,2,0.0,0,A. Varshney;A. Kaufman
974,23.234987,-29.043146,Vortex identification-applications in aerodynamics: a case study,1,0.0,1,D. Kenwright;R. Haimes
975,30.529854,1.9726963,A visualization of music,1,0.0,0,S.M. Smith;G.N. Williams
976,-5.6738596,3.795904,"The ""Which Blair project"": a quick visual method for evaluating perceptual color maps",1,0.0,0,B.E. Rogowitz;A.D. Kalvin
977,-28.227524,-41.514404,Graphical encoding for information visualization: an empirical study,1,1.0,0,L. Nowell;R. Schulman;D. Hix
978,-11.8503685,-14.051048,A visual exploration process for the analysis of Internet routing data,1,0.0,0,Soon Tee Teoh;Kwan-Liu Ma;S.F. Wu
979,-6.683932,36.475174,Visualizing industrial CT volume data for nondestructive testing applications,1,0.0,0,R. Huang;Kwan-Liu Ma;P. McCormick;W. Ward
980,-8.091529,-2.0915222,Exploratory Visualization of Multivariate Data with Variable Quality,1,0.0,0,Zaixian Xie;Shiping Huang;Matthew O. Ward;Elke A. Rundensteiner
981,-30.91696,-28.589582,Geographically Weighted Visualization: Interactive Graphics for Scale-Varying Exploratory Analysis,0,0.0,0,Jason Dykes;Chris Brunsdon
982,-0.046786185,-7.1787724,Intelligent Visual Analytics Queries,1,0.0,0,Ming C. Hao;Umeshwar Dayal;Daniel A. Keim;Dominik Morent;Joern Schneidewind
983,15.974727,0.6258145,Two-Level Approach to Efficient Visualization of Protein Dynamics,0,1.0,0,Ove Daae Lampe;Ivan Viola;Nathalie Reuter;Helwig Hauser
984,10.90291,-11.021402,Particle-based labeling: Fast point-feature labeling without obscuring other visual features,0,0.0,0,Martin Luboschik;Heidrun Schumann;Hilko Cords
985,32.12904,22.729845,Rapid Graph Layout Using Space filling Curves,0,1.0,0,Chris Muelder;Kwan-Liu Ma
986,23.018883,50.57078,Multi-Scale Surface Descriptors,0,1.0,0,Gregory Cipriano;George N. Phillips Jr.;Michael Gleicher
987,-6.126347,33.342926,Stress Tensor field Visualization for Implant Planning in Orthopedics,0,1.0,0,Christian Dick;Joachim Georgii;Rainer Burgkart;Rüdiger Westermann
988,-1.2047857,5.666493,Visualization by Proxy: A Novel Framework for Deferred Interaction with Volume Data,0,1.0,0,Anna Tikhonova;Carlos D. Correa;Kwan-Liu Ma
989,6.901287,-4.5056024,Automatic Transfer Functions Based on Informational Divergence,0,1.0,0,Marc Ruiz;Anton Bardera;Imma Boada;Ivan Viola;Miquel Feixas;Mateu Sbert
990,-15.200792,-46.855206,Multi-Touch Table System for Medical Visualization: Application to Orthopedic Surgery Planning,0,1.0,0,Claes Lundstrom;Thomas Rydell;Camilla Forsell;Anders Persson;Anders Ynnerman
991,6.4150515,-0.31393278,Perception of Average Value in Multiclass Scatterplots,0,2.0,0,Michael Gleicher;Michael Correll;Christine Nothelfer;Steven Franconeri
992,-5.335018,-41.43148,Visual Sedimentation,0,1.0,0,Samuel Huron;Romain Vuillemot;Jean-Daniel Fekete
993,-18.21376,-12.985715,TelCoVis: Visual Exploration of Co-occurrence in Urban Human Mobility Based on Telco Data,0,1.0,0,Wenchao Wu;Jiayi Xu;Haipeng Zeng;Yixian Zheng;Huamin Qu;Bing Ni;Mingxuan Yuan;Lionel M. Ni
994,-32.75821,-20.854977,Strata-various: multi-layer visualization of dynamics in software system behavior,1,0.0,0,D. Kimelman;B. Rosenburg;T. Roth
995,-9.220289,42.45832,Direct rendering of Laplacian pyramid compressed volume data,1,0.0,0,M.H. Ghavamnia;X.D. Yang
996,-9.703147,46.533882,Deformable volume rendering by 3D texture mapping and octree encoding,1,0.0,0,Shiaofen Fang;Su Huang;Rajagopalan Srinivasan;Raghu Raghavan
997,35.59888,5.1461167,Volume Thinning for Automatic Isosurface Propagation,1,0.0,0,T. Itoh;Y. Yamaguchi;K. Koyamada
998,-29.320549,-10.2627,"Archaeological Data Visualization in VR: Analysis of Lamp Finds at the Great Temple of Petra, a Case Study",1,0.0,0,D. Acevedo;E. Vote;D.H. Laidlaw;M.S. Joukowsky
999,7.385103,-30.521364,Integration of measurement tools in medical 3d visualizations,1,0.0,0,B. Preim;C. Tietjen;W. Spindler;H.-O. Peitgen
1000,38.960354,19.276659,Stream line and path line oriented topology for 2D time-dependent vector fields,1,0.0,0,H. Theisel;T. Weinkauf;H.-C. Hege;H.-P. Seidel
1001,19.896103,52.20264,Lines of Curvature for Polyp Detection in Virtual Colonoscopy,0,1.0,0,Lingxiao Zhao;Charl Botha;Javier Bescos;Roel Truyen;Frans Vos;Frits Post
1002,-24.544054,-24.329744,Multi-Focused Geospatial Analysis Using Probes,0,0.0,0,Thomas Butkiewicz;Wenwen Dou;Zachary Wartell;William Ribarsky;Remco Chang
1003,-9.676123,51.22043,Direct Volume Editing,0,1.0,0,Kai Bürger;Jens Krüger;Rüdiger Westermann
1004,-37.02087,-11.539134,Interactive Visual Steering - Rapid Visual Prototyping of a Common Rail Injection System,0,0.0,0,Kresimir Matkovic;Denis Gracanin;Mario Jelovic;Helwig Hauser
1005,32.206303,5.773773,Two-stage framework for visualization of clustered high dimensional data,1,0.0,0,Jaegul Choo;Shawn Bohn;Haesun Park
1006,27.914669,52.40701,Markerless View-Independent Registration of Multiple Distorted Projectors on Extruded Surfaces Using an Uncalibrated Camera,0,0.0,1,Behzad Sajadi;Aditi Majumder
1007,32.96385,-0.9197762,A Novel Interface for Interactive Exploration of DTI fibers,0,1.0,0,Wei Chen;Zi'ang Ding;Song Zhang;Anna MacKay-Brandt;Stephen Correia;Huamin Qu;John Allen Crow;David F. Tate;Zhicheng Yan;Qunsheng Peng
1008,17.778015,-20.745552,Parameter Sensitivity Visualization for DTI fiber Tracking,0,1.0,0,Ralph Brecheisen;Anna Vilanova;Bram Platel;Bart ter Haar Romeny
1009,-7.8983455,44.353355,Volume Ray Casting with Peak finding and Differential Sampling,0,1.0,0,Aaron Knoll;Younis Hijazi;Rolf Westerteiger;Mathias Schott;Charles Hansen;Hans Hagen
1010,22.130459,47.71943,Illustrative Stream Surfaces,0,2.0,1,Silvia Born;Alexander Wiebel;Jan Friedrich;Gerik Scheuermann;Dirk Bartz
1011,-11.605051,-4.449514,Network-based visual analysis of tabular data,1,1.0,1,Zhicheng Liu;Shamkant B. Navathe;John T. Stasko
1012,-7.7366004,34.883644,Visual sentiment analysis on twitter data streams,2,0.0,0,Ming Hao;Christian Rohrdantz;Halldór Janetzko;Umeshwar Dayal;Daniel A. Keim;Lars-Erik Haug;Mei-Chun Hsu
1013,-6.973231,-32.366455,Memorability of Visual Features in Network Diagrams,0,1.0,0,Kim Marriott;Helen Purchase;Michael Wybrow;Cagatay Goncu
1014,-18.560097,-41.855286,Sketchy Rendering for Information Visualization,0,1.0,0,Jo Wood;Petra Isenberg;Tobias Isenberg;Jason Dykes;Nadia Boukhelifa;Aidan Slingsby
1015,-0.93999964,-47.541706,Taxonomy-Based Glyph Design---with a Case Study on Visualizing Workflows of Biological Experiments,0,2.0,0,Eamonn Maguire;Philippe Rocca-Serra;Susanna-Assunta Sansone;Jim Davies;Min Chen
1016,-29.05872,-41.01622,An Information-Aware Framework for Exploring Multivariate Data Sets,0,1.0,0,Ayan Biswas;Soumya Dutta;Han-Wei Shen;Jonathan Woodring
1017,18.283516,-3.1580691,Fast Generation of Virtual X-ray Images for Reconstruction of 3D Anatomy,0,0.0,0,Moritz Ehlke;Heiko Ramm;Hans Lamecker;Hans-Christian Hege;Stefan Zachow
1018,10.207045,-6.5054607,Explainers: Expert Explorations with Crafted Projections,0,2.0,1,Michael Gleicher
1019,26.595783,0.72015095,Proactive Spatiotemporal Resource Allocation and Predictive Visual Analytics for Community Policing and Law Enforcement,0,1.0,0,Abish Malik;Ross Maciejewski;Sherry Towers;Sean McCullough;David S. Ebert
1020,-31.041441,7.5250344,Beyond Weber's Law: A Second Look at Ranking Visualizations of Correlation,0,0.0,1,Matthew Kay;Jeffrey Heer
1021,-4.2452545,-29.709642,FeatureInsight: Visual support for error-driven feature ideation in text classification,1,1.0,0,Michael Brooks;Saleema Amershi;Bongshin Lee;Steven M. Drucker;Ashish Kapoor;Patrice Simard
1022,-11.176736,-0.13604438,Embedded Data Representations,0,2.0,0,Wesley Willett;Yvonne Jansen;Pierre Dragicevic
1023,-0.9797411,-7.9269595,Visualization and analysis of multi-variate data: a technique for all fields,1,0.0,0,T. Mihalisin;J. Timlin;J. Schwegler
1024,-7.351899,-16.313862,BLaC-wavelets: a multiresolution analysis with non-nested spaces,1,0.0,0,G.-P. Bonneau;S. Hahmann;G.M. Nielson
1025,-20.034939,-30.52722,VizWiz: a Java applet for interactive 3D scientific visualization on the Web,1,0.0,0,C. Michaels;M. Bailey
1026,32.541077,1.7084327,Quantitative comparative evaluation of 2D vector field visualization methods,1,0.0,0,D.H. Laidlaw;R.M. Kirby;J.S. Davidson;T.S. Miller;M. da Silva;W.H. Warren;M. Tarr
1027,18.984922,50.60223,Normal bounds for subdivision-surface interference detection,1,1.0,0,E. Grinspun;P. Schroder
1028,41.409252,23.292374,Computing singularities of 3D vector fields with geometric algebra,1,0.0,0,S. Mann;A. Rockwood
1029,19.34247,-27.217283,Comparative evaluation of visualization and experimental results using image comparison metrics,1,0.0,0,Hualin Zhou;Min Chen;M.F. Webster
1030,-39.164238,17.150274,Constrained inverse volume rendering for planetary nebulae,1,1.0,0,M. Magnor;G. Kindlmann;N. Duric;C. Hansen
1031,-4.4163275,37.89798,A shader-based parallel rendering framework,1,1.0,0,J. Allard;B. Raffin
1032,-1.6644,13.919033,Multi-Scale Banking to 45 Degrees,0,0.0,0,Jeffrey Heer;Maneesh Agrawala
1033,1.5986961,-11.463179,Pixnostics: Towards Measuring the Value of Visualization,1,0.0,0,Jorn Schneidewind;Mike Sips;Daniel A. Keim
1034,10.76292,51.388325,Mesh Layouts for Block-Based Caches,0,1.0,0,Sung-eui Yoon;Peter Lindstrom
1035,-41.80948,21.856379,Stochastic DT-MRI Connectivity Mapping on the GPU,0,2.0,0,Tim McGraw;Mariappan Nadar
1036,10.629284,18.65353,Texture-based feature tracking for effective time-varying data visualization,0,0.0,0,Jesus Caban;Alark Joshi;Penny Rheingans
1037,-44.303066,14.177117,Focus+Context Visualization with Distortion Minimization,0,0.0,0,Yu-Shuen Wang;Tong-Yee Lee;Chiew-Lan Tai
1038,37.790215,-1.3150449,Exploring the Millennium Run - Scalable Rendering of Large-Scale Cosmological Datasets,0,0.0,0,Roland Fraedrich;Jens Schneider;Rüdiger Westermann
1039,9.13813,-10.860324,Stacking Graphic Elements to Avoid Over-Plotting,0,1.0,0,Tuan Nhon Dang;Leland Wilkinson;Anushka Anand
1040,-20.608505,-6.4659195,Graphical Overlays: Using Layered Elements to Aid Chart Reading,0,1.0,0,Nicholas Kong;Maneesh Agrawala
1041,5.5300784,0.6634494,Radial Sets: Interactive Visual Analysis of Large Overlapping Sets,0,1.0,0,Bilal Alsallakh;Wolfgang Aigner;Silvia Miksch;Helwig Hauser
1042,19.882675,-13.093607,Feature-Driven Visual Analytics of Soccer Data,1,1.0,0,Halld'or Janetzko;Dominik Sacha;Manuel Stein;Tobias Schreck;Daniel A. Keim;Oliver Deussen
1043,30.400066,-24.57592,"Visualization, Selection, and Analysis of Traffic Flows",0,1.0,0,Roeland Scheepens;Christophe Hurter;Huub Van De Wetering;Jarke J. Van Wijk
1044,15.543867,-4.4505796,CiteRivers: Visual Analytics of Citation Patterns,0,2.0,0,Florian Heimerl;Qi Han;Steffen Koch;Thomas Ertl
1045,4.9748464,-21.331915,OSPRay - A CPU Ray Tracing Framework for Scientific Visualization,0,2.0,0,I Wald;GP Johnson;J Amstutz;C Brownlee;A Knoll;J Jeffers;J Günther;P Navratil
1046,-24.669376,-26.446526,SemanticTraj: A New Approach to Interacting with Massive Taxi Trajectories,0,1.0,0,Shamal Al-Dohuki;Yingyu Wu;Farah Kamw;Jing Yang;Xin Li;Ye Zhao;Xinyue Ye;Wei Chen;Chao Ma;Fei Wang
1047,14.059329,-23.709621,The Hologram in My Hand: How Effective is Interactive Exploration of 3D Visualizations in Immersive Tangible Augmented Reality?,0,2.0,0,Benjamin Bach;Ronell Sicat;Johanna Beyer;Maxime Cordeil;Hanspeter Pfister
1048,22.655354,45.4069,Methods for surface interrogation,1,0.0,0,H. Hagen;T. Schreiber;E. Gschwind
1049,7.930524,37.89966,Approximation of isosurface in the Marching Cube: ambiguity problem,1,0.0,0,S.V. Matveyev
1050,-10.107595,45.62006,Two-phase perspective ray casting for interactive volume navigation,1,0.0,0,M. Brady;K. Jung;H.T. Nguyen;T. Nguyen
1051,-18.318306,-4.205837,Feature detection in linked derived spaces,1,0.0,0,C. Henze
1052,5.565412,3.6889334,PLIC: bridging the gap between streamlines and LIC,1,0.0,0,V. Verma;D. Kao;A. Pang
1053,-33.118454,-13.584524,New methods for the visualization of electric power system information,1,0.0,0,T.J. Overbye;J.D. Weber
1054,34.990704,20.64065,A level-set method for flow visualization,1,1.0,0,R. Westermann;C. Johnson;T. Ertl
1055,14.597975,2.9912958,Sea of images,1,1.0,0,D.G. Aliaga;T. Funkhouser;D. Yanovsky;I. Carlbom
1056,-6.5819283,-8.369419,Accelerating Network Traffic Analytics Using Query-Driven Visualization,1,1.0,0,E. Wes Bethel;Scott Campbell;Eli Dart;Kurt Stockinger;Kesheng Wu
1057,-4.736988,0.6880996,Spatialization Design: Comparing Points and Landscapes,0,0.0,0,Melanie Tory;David Sprague;Fuqu Wu;Wing Yan So;Tamara Munzner
1058,3.8275843,12.391307,Visualizing Whole-Brain DTI Tractography with GPU-based Tuboids and LoD Management,0,0.0,0,Vid Petrovic;James Fallon;Falko Kuester
1059,23.326027,14.858329,Registration Techniques for Using Imperfect and Par tially Calibrated Devices in Planar Multi-Projector Displays,0,1.0,0,Ezekiel Bhasker;Ray Juang;Aditi Majumder
1060,27.919048,6.448687,Smooth Graphs for Visual Exploration of Higher-Order State Transitions,0,0.0,0,Jorik Blaas;Charl Botha;Edward Grundy;Mark Jones;Robert Laramee;Frits Post
1061,-10.754528,-15.395812,Interactive Coordinated Multiple-View Visualization of Biomechanical Motion Data,0,0.0,0,Daniel Keefe;Marcus Ewert;William Ribarsky;Remco Chang
1062,8.131604,-24.738108,VisMashup: Streamlining the Creation of Custom Visualization Applications,0,1.0,0,Emanuele Santos;Lauro Lins;James Ahrens;Juliana Freire;Claudio Silva
1063,35.126377,-10.279788,Exploring Uncertainty in Geodemographics with Interactive Graphics,0,2.0,0,Aidan Slingsby;Jason Dykes;Jo Wood
1064,-31.633055,17.48668,Adaptive Extraction and Quantification of Geophysical Vortices,0,0.0,0,Sean Williams;Mark Petersen;Peer-Timo Bremer;Matthew Hecht;Valerio Pascucci;James Ahrens;Mario Hlawitschka;Bernd Hamann
1065,16.197598,-12.759119,Flow Radar Glyphs—Static Visualization of Unsteady Flow with Uncertainty,0,1.0,0,Marcel Hlawatsch;Philipp Leube;Wolfgang Nowak;Daniel Weiskopf
1066,-14.665928,-30.087276,The DeepTree Exhibit: Visualizing the Tree of Life to Facilitate Informal Learning,0,2.0,0,Florian Block;Michael S. Horn;Brenda Caldwell Phillips;Judy Diamond;E. Margaret Evans;Chia Shen
1067,16.080599,17.724173,Visual analytics methods for categoric spatio-temporal data,1,1.0,0,T. von Landesberger;Sebastian Bremm;Natalia Andrienko;Gennady Andrienko;Mária Tekušová
1068,1.0209434,-47.549553,"Analyst's Workspace: An embodied sensemaking environment for large, high-resolution displays",1,2.0,0,Christopher Andrews;Chris North
1069,3.9263427,-3.918968,Space Transformation for Understanding Group Movement,0,1.0,0,Natalia Andrienko;Gennady Andrienko;Louise Barrett;Marcus Dostie;Peter Henzi
1070,-35.337887,8.913816,Characterizing Guidance in Visual Analytics,0,2.0,0,Davide Ceneda;Theresia Gschwandtner;Thorsten May;Silvia Miksch;Hans-Jörg Schulz;Marc Streit;Christian Tominski
1071,-10.036225,-27.24039,Classifying visual knowledge representations: a foundation for visualization research,1,1.0,0,J. Lohse;H. Rueter;K. Biolsi;N. Walker
1072,-38.531147,12.911093,Automatic illustration of 3D geometric models: surfaces,1,0.0,0,D. Dooley;M.F. Cohen
1073,19.868555,45.487415,Rendering surface-particles,1,0.0,0,J.J. van Wijk
1074,8.20422,32.999535,Automatic generation of triangular irregular networks using greedy cuts,1,0.0,0,C.T. Silva;J.S.B. Mitchell;A.E. Kaufman
1075,12.016095,34.348698,Visualization of higher order singularities in vector fields,1,0.0,0,G. Scheuermann;H. Hagen;H. Kruger;M. Menzel;A. Rockwood
1076,-10.15083,2.2429364,Multivariate visualization using metric scaling,1,0.0,0,Pak Chung Wong;R.D. Bergeron
1077,41.318764,17.967548,The motion map: efficient computation of steady flow animations,1,0.0,0,B. Jobard;W. Lefer
1078,16.594357,7.872817,Interactive display of very large textures,1,0.0,0,D. Cline;P.K. Egbert
1079,-27.840567,-43.687386,Sensemaking of evolving Web sites using visualization spreadsheets,1,0.0,0,E.H. Chi;S.K. Card
1080,-40.452686,19.851137,Efficient compression of non-manifold polygonal meshes,1,0.0,0,A. Gueziec;F. Bossen;G. Taubin;C. Silva
1081,10.420887,26.005314,High performance presence-accelerated ray casting,1,0.0,0,M. Wan;A. Kaufman;S. Bryson
1082,-41.777336,13.537275,"Tetrahedron based, least squares, progressive volume models with application to freehand ultrasound data",1,0.0,0,T. Roxborough;G.M. Nielson
1083,20.243244,50.38326,New techniques for topologically correct surface reconstruction,1,0.0,0,U. Adamy;J. Giesen;M. John
1084,17.543362,42.63196,Fast visualization of plane-like structures in voxel data,1,0.0,0,S. Prohaska;H.-C. Hege
1085,23.975338,48.827065,Direct surface extraction from 3D freehand ultrasound images,1,0.0,0,Youwei Zhang;R. Rohling;D.K. Pai
1086,36.649754,2.5379868,"PMR: point to mesh rendering, a feature-based approach",1,1.0,0,T.K. Dey;J. Hudson
1087,38.85231,23.450874,Flow field clustering via algebraic multigrid,1,0.0,0,M. Griebel;T. Preusser;M. Rumpf;M.A. Schweitzer;A. Telea
1088,-11.930534,2.0367472,Distributed data management for large volume visualization,1,0.0,0,J. Gao;J. Huang;C.R. Johnson;S. Atchley
1089,-3.0353713,-23.361645,"Toward a Multi-Analyst, Collaborative Framework for Visual Analytics",1,0.0,0,Susan E. Brennan;Klaus Mueller;Greg Zelinsky;IV Ramakrishnan;David S. Warren;Arie Kaufman
1090,-9.2990885,0.99710923,Illustrative Deformation for Data Exploration,0,1.0,0,Carlos Correa;Debora Silver;Mi Chen
1091,-13.9107,19.797209,The Seismic Analyzer: Interpreting and Illustrating 2D Seismic Data,0,0.0,0,Daniel Patel;Christopher Giertsen;John Thurmond;John Gjelberg;Eduard Grøller
