,0,1,title,paper_type,cite_number,award,names
1780,-0.24828692,15.6529,Verifiable Visualization for Isosurface Extraction,0,0.0,0,Tiago Etiene;Carlos Scheidegger;Luis Gustavo Nonato;Robert Mike Kirby;Cláudio Silva
1781,-40.72759,16.90828,Edge Aware Anisotropic Diffusion for 3D Scalar Data,0,1.0,0,Zahid Hosssain;Torsten Moller
1782,34.674644,15.842535,A Scale Space Based Persistence Measure for Critical Points in 2D Scalar fields,0,1.0,0,Jan Reininghaus;Natallia Kotava;David Guenther;Jens Kasten;Hans Hagen;Ingrid Hotz
1783,-5.081549,25.026001,iView: A Feature Clustering Framework for Suggesting Informative Views in Volume Visualization,0,1.0,0,Ziyi Zheng;Nafees Ahmed;Klaus Mueller
1784,3.0723739,-44.287724,Variant View: Visualizing Sequence Variants in their Gene Context,0,1.0,0,Joel A. Ferstay;Cydney B. Nielsen;Tamara Munzner
1785,-30.112574,10.027511,Visual Analytics for Comparison of Ocean Model Output with Reference Data: Detecting and Analyzing Geophysical Processes Using Clustering Ensembles,0,1.0,0,Patrick Köthur;Mike Sips;Henryk Dobslaw;Doris Dransch
1786,-21.276106,3.9194999,Occlusion-free Blood Flow Animation with Wall Thickness Visualization,0,1.0,0,Kai Lawonn;Sylvia Glaßer;Anna Vilanova;Bernhard Preim;Tobias Isenberg
1787,-5.8080134,-42.043068,Urbane: A 3D framework to support data driven decision making in urban development,1,1.0,0,Nivan Ferreira;Marcos Lage;Harish Doraiswamy;Huy Vo;Luc Wilson;Heidi Werner;Muchan Park;Cláudio Silva
1788,16.536844,-23.996473,Evaluation of Graph Sampling: A Visualization Perspective,0,2.0,0,Yanhong Wu;Nan Cao;Daniel Archambault;Qiaomu Shen;Huamin Qu;Weiwei Cui
1789,-1.3152794,-41.185932,Blockwise Human Brain Network Visual Comparison Using NodeTrix Representation,0,1.0,0,Xinsong Yang;Lei Shi;Madelaine Daianu;Hanghang Tong;Qingsong Liu;Paul Thompson
1790,-5.0271,-49.365223,"The Good, the Bad, and the Ugly: A Theoretical Framework for the Assessment of Continuous Colormaps",0,2.0,0,Roxana Bujack;Terece L. Turton;Francesca Samsel;Colin Ware;David H. Rogers;James Ahrens
1791,-5.662151,-19.64329,Visualizing Confidence in Cluster-Based Ensemble Weather Forecast Analyses,0,2.0,0,Alexander Kumpf;Bianca Tost;Marlene Baumgart;Michael Riemer;Rüdiger Westermann;Marc Rautenhaus
1792,-5.965256,-49.118782,What Do We Talk About When We Talk About Dashboards?,0,2.0,0,Alper Sarikaya;Michael Correll;Lyn Bartram;Melanie Tory;Danyel Fisher
1793,-41.932816,10.671329,Extracting geometric models through constraint minimization,1,0.0,0,J.V. Miller;D.E. Breen;M.J. Wozny
1794,21.483288,45.090252,Wide-band relativistic Doppler effect visualization,1,0.0,0,P.-K. Hsiung;R.H. Thibadeau;C.B. Cox;R.H.P. Dunn;M. Wu;P.A. Olbrich
1795,-28.640352,-14.098706,Integration of visualization and scientific calculation in a software system,1,0.0,0,U. Lang;R. Lang;R. Ruhle
1796,6.603324,33.040005,A library for visualizing combinatorial structures,1,0.0,0,M.A. Najork;M.H. Brown
1797,-31.514566,-40.04061,DEPICT: Documents Evaluated as Pictures. Visualizing information using context vectors and self-organizing maps,1,0.0,0,D.A. Rushall;M.R. Ilgen
1798,40.63954,28.221199,Raycasting vector fields,1,0.0,0,T. Fruhauf
1799,-1.9184121,24.625193,Real-time slicing of data space,1,1.0,0,R.A. Crawfis
1800,-24.624092,-10.527421,Cacti: a front end for program visualization,1,0.0,0,S.P. Reiss
1801,2.2389438,12.111353,BiblioMapper: a cluster-based information visualization technique,1,0.0,0,Min Song
1802,-23.218382,-10.41461,Production visualization for the ASCI One TeraFLOPS machine,1,0.0,1,P.D. Heermann
1803,35.641335,-17.05233,A case study using the virtual environment for reconstructive surgery,1,0.0,0,K. Montgomery;M. Stephanides;S. Schendel;M. Ross
1804,0.76012516,13.799964,Three-dimensional visualization of microstructures,1,0.0,0,M. Lanzagorta;M.V. Kral;J.E. Swan;G. Spanos;R. Rosenberg;E. Kuo
1805,9.464227,-1.2913187,Visualizing massive multi-digraphs,1,0.0,0,J. Abello;J. Korn
1806,-6.1245947,-48.69166,Navigating high-dimensional spaces to support design steering,1,0.0,0,H. Wright;K. Brodlie;T. David
1807,-21.277534,-28.004272,User-centric viewpoint computation for haptic exploration and manipulation,1,1.0,0,M.A. Otaduy;M.C. Lin
1808,-33.44147,27.79008,Interactive spectral volume rendering,1,1.0,0,S. Bergner;T. Moller;M.S. Drew;G.D. Finlayson
1809,-41.10295,-4.5812664,Evaluation of a multimodal interface for 3D terrain visualization,1,0.0,0,D.M. Krum;O. Omoteso;W. Ribarsky;T. Starner;L.F. Hodges
1810,-38.51243,16.669052,A model of multi-scale perceptual organization in information graphics,1,1.0,0,M. Wattenberg;D. Fisher
1811,-12.142034,19.225624,Feature-space analysis of unstructured meshes,1,1.0,0,A. Shamir
1812,-19.843206,-32.27616,Expand-Ahead: A Space-Filling Strategy for Browsing Trees,1,0.0,0,M.J. McGuffin;G. Davison;R. Balakrishnan
1813,14.592424,-50.017742,Vol-a-Tile - A Tool for Interactive Exploration of Large Volumetric Data on Scalable Tiled Displays,2,0.0,0,N. Schwarz;S. Venkataraman;Luc Renambot;N. Krishnaprasad;V. Vishwanath;J. Leigh;A. Johnson;G. Kent;A. Nayak
1814,5.741974,35.004906,Compatible triangulations of spatial decompositions,1,1.0,0,W.J. Schroeder;B. Geveci;M. Malaterre
1815,-10.157737,29.665909,Generating sub-resolution detail in images and volumes using constrained texture synthesis,1,0.0,0,Lujin Wang;K. Mueller
1816,-37.70175,14.692273,Non-linear model fitting to parameterize diseased blood vessels,1,0.0,0,A. La Cruz;M. Straka;A. Kochl;M. Sramek;E. Groller;D. Fleischmann
1817,7.08229,-16.404446,Simple 3D glyphs for spatial multivariate data,1,0.0,0,C. Forsell;S. Seipel;M. Lind
1818,20.937698,49.257423,Multimodal exploration of the fourth dimension,1,1.0,0,A.J. Hanson;H. Zhang
1819,20.60301,50.825886,Reconstructing manifold and non-manifold surfaces from point clouds,1,0.0,0,J. Wang;M.M. Oliveira;A.E. Kaufman
1820,-47.067467,15.769525,Visualization of Barrier Tree Sequences,0,0.0,0,Christian Heine;Gerik Scheuermann;Christoph Flamm;Ivo L. Hofacker;Peter F. Stadler
1821,-12.054659,-6.3879504,Visualizing Multiwavelength Astrophysical Data,0,2.0,0,Hongwei Li;Chi-Wing Fu;Andrew Hanson
1822,-6.5670877,-13.392475,LSAView: A tool for visual exploration of latent semantic modeling,1,0.0,0,Patricia J. Crossno;Daniel M. Dunlavy;Timothy M. Shead
1823,18.621372,-9.692685,Visualizations everywhere: A Multiplatform Infrastructure for Linked Visualizations,0,0.0,0,Danyel Fisher;Steven Drucker;Roland Fernandez;Scott Ruble
1824,-8.169925,-18.887455,A closer look at note taking in the co-located collaborative visual analytics process,1,1.0,0,Narges Mahyar;Ali Sarvghad;Melanie Tory
1825,-13.730157,-2.901248,Scalable Multi-variate Analytics of Seismic and Satellite-based Observational Data,0,1.0,0,Xiaoru Yuan;He Xiao;Hanqi Guo;Peihong Guo;Wesley Kendall;Jian Huang;Yongxian Zhang
1826,4.3881974,-12.394043,Spatial Conditioning of Transfer Functions Using Local Material Distributions,0,1.0,0,Stefan Lindholm;Patric Ljung;Claes Lundstrom;Anders Persson;Anders Ynnerman
1827,12.408462,-38.78032,Visual Optimality and Stability Analysis of 3DCT Scan Positions,0,0.0,0,Artem Amirkhanov;Christoph Heinzl;Michael Reiter;Eduard Groller
1828,32.81902,4.029018,Crepuscular Rays for Tumor Accessibility Planning,0,1.0,0,Rostislav Khlebnikov;Bernhard Kainz;Judith Muehl;Dieter Schmalstieg
1829,16.35996,-4.1832848,Distance Visualization for Interactive 3D Implant Planning,0,0.0,0,Christian Dick;Rainer Burgkart;Rudiger Westermann
1830,-5.9857817,43.99117,Projection-Based Metal-Artifact Reduction for Industrial 3D X-ray Computed Tomography,0,1.0,0,Artem Amirkhanov;Christoph Heinzl;Michael Reiter;Johann Kastner;Eduard Groller
1831,3.929019,-41.745495,RelEx: Visualization for Actively Changing Overlay Network Specifications,0,1.0,0,Michael Sedlmair;Annika Frank;Tamara Munzner;Andreas Butz
1832,0.5650753,-28.85176,Watch this: A taxonomy for dynamic data visualization,1,1.0,0,Joseph A. Cottam;Andrew Lumsdaine;Chris Weaver
1833,-3.6263838,-47.61333,Using Concrete Scales: A Practical Framework for Effective Visual Depiction of Complex Measures,0,1.0,0,Fanny Chevalier;Romain Vuillemot;Guia Gali
1834,-36.847603,11.807457,Characterizing and Visualizing Predictive Uncertainty in Numerical Ensembles Through Bayesian Model Averaging,0,1.0,0,Luke Gosink;Kevin Bensema;Trenton Pulsipher;Harald Obermaier;Michael Henry;Hank Childs;Kenneth I. Joy
1835,17.99491,19.066364,TimeBench: A Data Model and Software Library for Visual Analytics of Time-Oriented Data,0,2.0,0,Alexander Rind;Tim Lammarsch;Wolfgang Aigner;Bilal Alsallakh;Silvia Miksch
1836,5.1009755,-30.56473,Moving beyond sequential design: Reflections on a rich multi-channel approach to data visualization,0,2.0,0,Jo Wood;Roger Beecham;Jason Dykes
1837,-5.9624996,6.4781985,Fast and Memory-Efficienty Topological Denoising of 2D and 3D Scalar Fields,0,0.0,0,David Günther;Alec Jacobson;Jan Reininghaus;Hans-Peter Seidel;Olga Sorkine-Hornung;Tino Weinkauf
1838,-39.09085,8.072458,"Towards Interactive, Intelligent, and Integrated Multimedia Analytics",1,2.0,0,Jan Zahálka;Marcel Worring
1839,-22.743187,-26.123238,LoyalTracker: Visualizing Loyalty Dynamics in Search Engines,0,1.0,1,Conglei Shi;Yingcai Wu;Shixia Liu;Hong Zhou;Huamin Qu
1840,16.584862,25.584753,Distribution Driven Extraction and Tracking of Features for Time-varying Data Analysis,0,1.0,0,Soumya Dutta;Han-Wei Shen
1841,-10.877593,-8.264966,Visualizing Dimension Coverage to Support Exploratory Analysis,0,1.0,0,Ali Sarvghad;Melanie Tory;Narges Mahyar
1842,-7.7707624,-10.658681,Visual Analytics for Mobile Eye Tracking,0,1.0,0,Kuno Kurzhals;Marcel Hlawatsch;Christof Seeger;Daniel Weiskopf
1843,-21.482561,-32.783016,VisTiles: Coordinating and Combining Co-located Mobile Devices for Visual Data Exploration,0,2.0,0,Ricardo Langner;Tom Horak;Raimund Dachselt
1844,4.351317,-21.377132,Orko: Facilitating Multimodal Interaction for Visual Exploration and Analysis of Networks,0,2.0,0,Arjun Srinivasan;John Stasko
1845,-19.505627,23.609272,Instant Construction and Visualization of Crowded Biological Environments,0,1.0,1,Tobias Klein;Ludovic Autin;Barbora Kozlíková;David S. Goodsell;Arthur Olson;M. Eduard Gröller;Ivan Viola
1846,-8.70452,-16.035688,Clustering Trajectories by Relevant Parts for Air Traffic Analysis,0,2.0,0,Gennady Andrienko;Natalia Andrienko;Georg Fuchs;Jose Manuel Cordero Garcia
1847,-15.147488,-8.831328,Voila: Visual Anomaly Detection and Monitoring with Streaming Spatiotemporal Data,0,2.0,0,Nan Cao;Chaoguang Lin;Qiuhan Zhu;Yu-Ru Lin;Xian Teng;Xidao Wen
1848,-47.24848,13.233332,Progressive Learning of Topic Modeling Parameters: A Visual Analytics Framework,0,1.0,1,Mennatallah El-Assady;Rita Sevastjanova;Fabian Sperrle;Daniel Keim;Christopher Collins
1849,-37.138874,3.2430208,GAN Lab: Understanding Complex Deep Generative Models using Interactive Visual Experimentation,0,1.0,0,Minsuk Kahng;Nikhil Thorat;Duen Horng (Polo) Chau;Fernanda B. Viégas;Martin Wattenberg
1850,-41.35144,4.4790416,RuleMatrix: Visualizing and Understanding Classifiers with Rules,0,1.0,0,Yao Ming;Huamin Qu;Enrico Bertini
1851,-3.6825826,14.286139,Evaluating Multi-Dimensional Visualizations for Understanding Fuzzy Clusters,0,2.0,0,Ying Zhao;Feng Luo;Minghui Chen;Yingchao Wang;Jiazhi Xia;Fangfang Zhou;Yunhai Wang;Yi Chen;Wei Chen
1852,16.416754,51.249798,"Spline-based color sequences for univariate, bivariate and trivariate mapping",1,0.0,0,B. Pham
1853,-12.980293,47.38077,NetV: an experimental network-based volume visualization system,1,0.0,0,T.T. Elvins;D.R. Nadeau
1854,-25.560226,-9.835673,Bridging the gap between visualization and data management: A simple visualization management system,1,0.0,0,P. Kochevar;Z. Ahmed;J. Shade;C. Sharp
1855,1.4571455,27.417635,Fine-grain visualization algorithms in dataflow environments,1,0.0,0,D. Song;E. Golin
1856,12.945441,8.599665,"Towards interactive steering, visualization and animation of unsteady finite element simulations",1,0.0,0,G.D. Kerlick;E. Kirby
1857,-42.248287,12.558446,3D simulation of delivery,1,0.0,0,J.-D. Boissonnat;B. Geiger
1858,-34.971195,24.580563,Parallel performance measures for volume ray casting,1,0.0,0,C.T. Silva;A.E. Kaufman
1859,-13.373715,40.253067,Virtual reality performance for virtual geometry,1,0.0,0,R.A. Cross;A.J. Hanson
1860,-32.913074,-9.254254,Clinical evaluation of interactive volume visualization,1,0.0,0,K.J. Zuiderveld;P.M.A. van Ooijen;J.W.C. Chin-A-Woeng;P.C. Buijs;M. Olree;F.H. Posti
1861,32.866264,-5.975152,Adaptive information visualization based on the user's multiple viewpoints - interactive 3D visualization of the WWW,1,0.0,0,T. Teraoka;M. Maruyama
1862,-16.30965,38.569183,Brushing techniques for exploring volume datasets,1,0.0,0,Pak Chung Wong;R.D. Bergeron
1863,-15.512665,10.532268,Traversal-based visualization of data structures,1,0.0,0,J.L. Korn;A.W. Appel
1864,-39.726677,13.657847,Wavelets over curvilinear grids,1,0.0,0,G.M. Nielson;Il.-H. Jung;J. Sung
1865,-18.022846,-18.252909,Visual presentation of magnetic resonance images,1,0.0,0,J.E. van der Heyden;M.S.T. Carpendale;K. Inkpen;M.S. Atkins
1866,-0.6888969,-25.749594,Domain analysis: a technique to design a user-centered visualization framework,1,0.0,0,O.J. Espinosa;C. Hendrickson;J.H. Garrett
1867,52.73087,-20.563536,Graph sketches,1,0.0,0,J. Abello;I. Finocchi;J. Korn
1868,38.793343,17.98835,Transport and anisotropic diffusion in time-dependent flow visualization,1,0.0,0,D. Burkle;T. Preusser;M. Rumpf
1869,-15.798416,47.771935,Volume Rendering of Fine Details Within Medical Data,1,0.0,0,Feng Dong;G.J. Clapworthy;M. Krokos
1870,4.560398,37.003616,Volumetric shadows using splatting,1,0.0,0,Caixia Zhang;R. Crawfis
1871,0.62547594,28.697023,A virtual workspace for hybrid multidimensional scaling algorithms,1,0.0,0,G. Ross;M. Chalmers
1872,19.383673,21.443218,Pixel-exact rendering of spacetime finite element solutions,1,1.0,0,Yuan Zhou;M. Garland;R. Haber
1873,-9.098394,47.69682,Rendering implicit flow volumes,1,1.0,0,D. Xue;C. Zhang;R. Crawfis
1874,44.302032,21.435053,2D asymmetric tensor analysis,1,0.0,0,X. Zheng;A. Pang
1875,36.137196,-3.2941513,Dataset traversal with motion-controlled transfer functions,1,0.0,0,C.D. Correa;D. Silver
1876,-13.946093,25.03889,Smashing Peacocks Further: Drawing Quasi-Trees from Biconnected Components,0,0.0,0,Daniel Archambault;Tamara Munzner;David Auber
1877,-13.074607,-7.2359695,An Atmospheric Visual Analysis and Exploration System,0,1.0,0,Yuyan Song;Jing Ye;Nikolai Svakhine;Sonia Lasher-Trapp;Mike Baldwin;David Ebert
1878,-32.280704,-16.360346,Activity Analysis Using Spatio-Temporal Trajectory Volumes in Surveillance Applications,1,0.0,0,Firdaus Janoos;Shantanu Singh;Okan Irfanoglu;Raghu Machiraju;Richard Parent
1879,-1.0918514,-1.2140676,Glyph-Based SPECT Visualization for the Diagnosis of Coronary Artery Disease,0,0.0,0,Jennis Meyer-Spradow;Lars Stegger;Christian Döring;Timo Ropinski;Klaus Hinrichs
1880,-15.854699,46.347996,Relation-Aware Volume Exploration Pipeline,0,0.0,0,Ming-Yuen Chan;Huamin Qu;Ka-Kei Chung;Wai-Ho Mak;Yingcai Wu
1881,8.51431,34.810036,Visibility-driven Mesh Analysis and Visualization through Graph Cuts,0,0.0,0,Kaichi Zhou;Eugene Zhang;Jiˇr´ı Bittner;Peter Wonka
1882,-11.544702,-29.407856,Laws of Attraction: From Perceptual Forces to Conceptual Similarity,0,0.0,0,Caroline Ziemkiewicz;Robert Kosara
1883,-10.153261,-18.270187,Pointwise local pattern exploration for sensitivity analysis,1,0.0,0,Zhenyu Guo;Matthew O. Ward;Elke A. Rundensteiner;Carolina Ruiz
1884,43.918835,31.066002,Visualization of Electrostatic Dipoles in Molecular Dynamics of Metal Oxides,0,1.0,0,Sebastian Grottel;Philipp Beck;Christoph Müller;Guido Reina;Johannes Roth;Hans-Rainer Trebin;Thomas Ertl
1885,-15.853421,-50.18772,AlVis: Situation awareness in the surveillance of road tunnels,1,1.0,0,Harald Piringer;Matthias Buchetics;Rudolf Benedik
1886,11.512821,30.510601,Efficient Local Statistical Analysis via Integral Histograms with Discrete Wavelet Transform,0,1.0,0,Teng-Yok Lee;Han-Wei Shen
1887,1.177611,-8.259175,Nmap: A Novel Neighborhood Preservation Space-filling Algorithm,0,0.0,0,Felipe S. L. G. Duarte;Fabio Sikansi;Francisco M. Fatore;Samuel G. Fadel;Fernando V. Paulovich
1888,-6.154101,29.129406,Low-Pass Filtered Volumetric Shadows,0,1.0,0,Marco Ament;Filip Sadlo;Carsten Dachsbacher;Daniel Weiskopf
1889,-14.3166895,-43.990494,DIA2: Web-based Cyberinfrastructure for Visual Analysis of Funding Portfolios,0,1.0,0,Krishna Madhavan;Niklas Elmqvist;Mihaela Vorvoreanu;Xin Chen;Yuetling Wong;Hanjun Xian;Zhihua Dong;Aditya Johri
1890,16.6828,-27.122534,Speculative Practices: Utilizing InfoVis to Explore Untapped Literary Collections,0,2.0,0,Uta Hinrichs;Stefania Forlini;Bridget Moynihan
1891,11.201147,34.62646,Diderot: a Domain-Specific Language for Portable Parallel Scientific Visualization and Image Analysis,0,2.0,0,Gordon Kindlmann;Charisee Chiw;Nicholas Seltzer;Lamont Samuels;John Reppy
1892,-24.804276,3.2102587,Exploring Evolving Media Discourse Through Event Cueing,0,1.0,0,Yafeng Lu;Michael Steptoe;Sarah Burke;Hong Wang;Jiun-Yi Tsai;Hasan Davulcu;Douglas Montgomery;Steven R. Corman;Ross Maciejewski
1893,-9.590526,-47.978462,LiteVis: Integrated Visualization for Simulation-Based Decision Support in Lighting Design,0,1.0,0,Johannes Sorger;Thomas Ortner;Christian Luksch;Michael Schwärzler;Eduard Gröller;Harald Piringer
1894,-2.4437258,-49.539757,Bubble Treemaps for Uncertainty Visualization,0,1.0,0,Jochen Görtler;Christoph Schulz;Daniel Weiskopf;Oliver Deussen
1895,-19.131771,-6.1779056,Podium: Ranking Data Using Mixed-Initiative Visual Analytics,0,1.0,0,Emily Wall;Subhajit Das;Ravish Chawla;Bharath Kalidindi;Eli T. Brown;Alex Endert
1896,1.315145,33.570705,Towards a Systematic Combination of Dimension Reduction and Clustering in Visual Analytics,0,2.0,0,John Wenskovitch;Ian Crandell;Naren Ramakrishnan;Leanna House;Scotland Leman;Chris North
1897,-11.998422,-34.32973,Visual query specification in a multimedia database system,1,0.0,0,D.A. Keim;V. Lum
1898,-31.8572,-2.6497478,Interactive shading for surface and volume visualization on graphics workstations,1,0.0,0,P.A. Fletcher;P.K. Robertson
1899,-34.07598,24.352842,Volume rendering methods for computational fluid dynamics visualization,1,0.0,0,D.S. Ebert;R. Yagel;J. Scott;Y. Kurzion
1900,20.644922,26.201227,3D visualization of unsteady 2D airplane wake vortices,1,0.0,0,Kwan-Liu Ma;Z.C. Zheng
1901,53.548687,-16.667887,Fast Algorithms for Visualizing Fluid Motion in Steady Flow on Unstructured Grids,1,0.0,0,S.K. Ueng;K. Sikorski;Kwan-Liu Ma
1902,16.405897,48.6702,A fast Gibbs sampler for synthesizing constrained fractals,1,0.0,0,B.C. Vemuri;C. Mandal
1903,39.507988,14.903005,Untangling Knots by Stochastic Energy Optimization,1,0.0,0,Milana Huang;R.P. Grzeszczuk;L.H. Kauffman
1904,10.642328,-37.94568,exVis: developing a wind tunnel data visualization tool,1,0.0,0,S.P. Uselton
1905,-20.61209,20.597656,A concept for virtual reality tools for design reviews,1,0.0,0,K. Kremer
1906,30.884516,40.58863,Visualizing Planar Vector Fields with Normal Component Using Line Integral Convolution,1,0.0,0,G. Scheuermann;H. Barbach;H. Hagen
1907,19.58662,-6.190619,Cracking the cracking problem with Coons patches,1,0.0,0,G.M. Nielson;D. Holliday;T. Roxborough
1908,-32.68263,-18.901985,"Visualization of conflicts and resolutions in a ""Free Flight"" scenario",1,0.0,0,R. Azuma;H. Neely;M. Daily;M. Correa
1909,-7.0879316,-50.6382,Interactive problem solving via algorithm visualization,1,0.0,0,P. Pu;D. Lalanne
1910,54.574116,-18.11497,Technical note: visually encoding program test information to find faults in software,1,0.0,0,J. Eagan;M.J. Harrold;J.A. Jones;J. Stasko
1911,39.46704,-1.1518966,Efficient cartogram generation: a comparison,1,0.0,0,D.A. Keim;S.C. North;C. Panse;J. Schneidewind
1912,-2.4277668,-1.465733,PRIMA: A case study of using information visualization techniques for patient record analysis,1,0.0,0,D.L. Gresh;D.A. Rabenhorst;A. Shabo;S. Slavin
1913,34.20613,2.327055,Real-time refinement and simplification of adaptive triangular meshes,1,1.0,0,V. Volkov;Ling Li
1914,-33.98173,-12.0610075,AdaptiviTree: Adaptive Tree Visualization for Tournament-Style Brackets,0,0.0,0,Desney Tan;Greg Smith;Bongshin Lee;George Robertson
1915,-31.539904,-16.059122,Using visual analytics to maintain situation awareness in astrophysics,1,1.0,0,Cecilia R. Aragon;Sarah S. Poon;Gregory S. Aldering;Rollin C. Thomas;Robert Quimby
1916,12.59902,-7.570938,A Visual Approach to Efficient Analysis and Quantification of Ductile Iron and Reinforced Sprayed Concrete,0,0.0,0,Laura Fritz;Markus Hadwiger;Georg Geier;Gerhard Pittino;M. Eduard Groller
1917,-3.955417,-51.78074,Quantitative Texton Sequences for Legible Bivariate Maps,0,0.0,0,Colin Ware
1918,13.971579,-23.306362,Evaluating the impact of task demands and block resolution on the effectiveness of pixel-based visualization,0,1.0,0,Rita Borgo;Karl Proctor;Min Chen;Heike Janicke;Tavi Murray;Ian Thornton
1919,17.49387,49.117687,Exploded View Diagrams of Mathematical Surfaces,0,1.0,0,Olga Karpenko;Wilmot Li;Niloy Mitra;Maneesh Agrawala
1920,-22.961725,-13.281201,GPU-Based Interactive Cut-Surface Extraction From High-Order finite Element fields,0,0.0,0,Blake Nelson;Robert M. Kirby;Robert Haimes
1921,-9.469678,16.649717,Interactive Volume Visualization of General Polyhedral Grids,0,1.0,0,Philipp Muigg;Markus Hadwiger;Helmut Doleisch;Eduard Groller
1922,37.961372,22.203451,Symmetry in Scalar field Topology,0,2.0,0,Dilip Mathew Thomas;Vijay Natarajan
1923,-9.227481,45.049038,Fuzzy Volume Rendering,0,1.0,0,Nathaniel Fout;Kwan-Liu Ma
1924,-23.592123,-27.228186,Scatter/Gather Clustering: Flexibly Incorporating User Feedback to Steer Clustering Results,0,2.0,0,M. Shahriar Hossain;Praveen Kumar Reddy Ojili;Cindy Grimm;Rolf Müller;Layne T. Watson;Naren Ramakrishnan
1925,19.81496,-23.463787,Supporting Awareness through Collaborative Brushing and Linking of Tabular Data,0,1.0,0,Amir Hossein Hajizadeh;Melanie Tory;Rock Leung
1926,-11.126555,-41.936066,Using Interactive Visual Reasoning to Support Sense-Making: Implications for Design,0,1.0,0,Neesha Kodagoda;Simon Attfield;B.L. William Wong;Chris Rooney;Sharmin Choudhury
1927,21.903324,-16.88287,"The relation between visualization size, grouping, and user performance",0,2.0,0,Connor C. Gramazio;Karen B. Schloss;David H. Laidlaw
1928,-16.396042,43.448757,Vivaldi: A Domain-Specific Language for Volume Processing and Visualization on Distributed Heterogeneous Systems,0,1.0,0,Hyungsuk Choi;Woohyuk Choi;Tran Minh Quan;David G. C. Hildebrand;Hanspeter Pfister;Won-Ki Jeong
1929,17.954613,49.791355,Ligand Excluded Surface: A New Type of Molecular Surface,0,1.0,0,Norbert Lindow;Daniel Baum;Hans-Christian Hege
1930,-30.602602,-43.315697,Combined Visualization of Wall Thickness and Wall Shear Stress for the Evaluation of Aneurysms,0,1.0,0,Sylvia Glaßer;Kai Lawonn;Thomas Hoffmann;Martin Skalej;Bernhard Preim
1931,30.397219,42.088947,Advection-Based Sparse Data Management for Visualizing Unsteady Flow,0,1.0,0,Hanqi Guo;Jiang Zhang;Richen Liu;Lu Liu;Xiaoru Yuan;Jian Huang;Xiangfei Meng;Jingshan Pan
1932,16.382805,15.364883,Vismate: Interactive Visual Analysis of Station-Based Observation Data on Climate Changes,1,2.0,0,Jie Li;Kang Zhang;Zhao-Peng Meng
1933,-26.384157,-18.57748,BoundarySeer: Visual Analysis of 2D Boundary Changes,1,1.0,0,Wenchao Wu;Yixian Zheng;Huamin Qu;Wei Chen;Eduard Gröller;Lionel M. Ni
1934,15.4344,-14.878605,YMCA - Your Mesh Comparison Application,1,1.0,0,Johanna Schmidt;Reinhold Preiner;Thomas Auzinger;Michael Wimmer;M. Eduard Gröller;Stefan Bruckner
1935,-6.449044,-46.219593,"Matches, Mismatches, and Methods: Multiple-View Workflows for Energy Portfolio Analysis",0,1.0,0,Matthew Brehmer;Jocelyn Ng;Kevin Tate;Tamara Munzner
1936,15.3917885,14.796434,Effective Visualization of Temporal Ensembles,0,0.0,0,Lihua Hao;Christopher G. Healey;Steffen A. Bass
1937,-7.0221324,-9.127395,3D Regression Heat Map Analysis of Population Study Data,0,1.0,0,Paul Klemm;Kai Lawonn;Sylvia Glaßer;Uli Niemann;Katrin Hegenscheid;Henry Völzke;Bernhard Preim
1938,-4.2533326,15.819683,Visualizing Social Media Content with SentenTree,0,1.0,0,Mengdie Hu;Krist Wongsuphasawat;John Stasko
1939,7.50355,11.547741,Probabilistic Graph Layout for Uncertain Network Visualization,0,1.0,0,Christoph Schulz;Arlind Nocaj;Jochen Goertler;Oliver Deussen;Ulrik Brandes;Daniel Weiskopf
1940,-30.88621,-14.696435,A Visual Analytics Approach for Understanding Reasons behind Snowballing and Comeback in MOBA Games,0,1.0,0,Quan Li;Peng Xu;Yeuk Yin Chan;Yun Wang;Zhipeng Wang;Huamin Qu;Xiaojuan Ma
1941,-37.43271,-20.859575,Familiarity Vs Trust: A Comparative Study of Domain Scientists' Trust in Visual Analytics and Conventional Analysis Methods,0,1.0,0,Aritra Dasgupta;Joon-Yong Lee;Ryan Wilson;Robert A. Lafrance;Nick Cramer;Kristin Cook;Samuel Payne
1942,-18.13399,-10.015661,iTTVis: Interactive Visualization of Table Tennis Data,0,1.0,0,Yingcai Wu;Ji Lan;Xinhuan Shu;Chenyang Ji;Kejian Zhao;Jiachen Wang;Hui Zhang
1943,-2.11362,-12.778085,HiPiler: Visual Exploration of Large Genome Interaction Matrices with Interactive Small Multiples,0,1.0,0,Fritz Lekschas;Benjamin Bach;Peter Kerpedjiev;Nils Gehlenborg;Hanspeter Pfister
1944,-8.280739,-47.660915,"Keeping Multiple Views Consistent: Constraints, Validations, and Exceptions in Visualization Authoring",0,1.0,1,Zening Qu;Jessica Hullman
1945,-38.735577,-21.496813,StreetVizor: Visual Exploration of Human-Scale Urban Forms Based on Street Views,0,1.0,0,Qiaomu Shen;Wei Zeng;Yu Ye;Stefan Müller Arisona;Simon Schubiger;Remo Burkhard;Huamin Qu
1946,-7.5763965,-7.0535216,SOMFlow: Guided Exploratory Cluster Analysis with Self-Organizing Maps and Analytic Provenance,0,2.0,0,Dominik Sacha;Matthias Kraus;Jürgen Bernard;Michael Behrisch;Tobias Schreck;Yuki Asano;Daniel A. Keim
