,0,1,title,paper_type,cite_number,award,names
2446,-23.707846,-42.303795,PROACT: Iterative Design of a Patient-Centered Visualization for Effective Prostate Cancer Health Risk Communication,0,2.0,0,Anzu Hakone;Lane Harrison;Alvitta Ottley;Nathan Winters;Caitlin Gutheil;Paul K. J. Han;Remco Chang
2447,14.085925,-10.836728,Optimizing Hierarchical Visualizations with the Minimum Description Length Principle,0,1.0,0,Rafael Veras;Christopher Collins
2448,2.5127637,15.704154,Visualization and Extraction of Carvings for Heritage Conservation,0,1.0,0,Kai Lawonn;Erik Trostmann;Bernhard Preim;Klaus Hildebrandt
2449,-47.398445,6.231563,A Fractional Cartesian Composition Model for Semi-Spatial Comparative Visualization Design,0,1.0,0,Ivan Kolesár;Stefan Bruckner;Ivan Viola;Helwig Hauser
2450,20.271547,-13.47006,Skeleton-Based Scagnostics,0,2.0,0,José Matute;Alexandru C. Telea;Lars Linsen
2451,-20.50459,-24.50577,EdWordle: Consistency-Preserving Word Cloud Editing,0,1.0,0,Yunhai Wang;Xiaowei Chu;Chen Bao;Lifeng Zhu;Oliver Deussen;Baoquan Chen;Michael Sedlmair
2452,-11.304788,48.858196,TopoAngler: Interactive Topology-Based Extraction of Fishes,0,1.0,0,Alexander Bock;Harish Doraiswamy;Adam Summers;Cláudio Silva
2453,-18.0686,19.747957,How Do Ancestral Traits Shape Family Trees Over Generations?,0,1.0,0,Siwei Fu;Hao Dong;Weiwei Cui;Jian Zhao;Huamin Qu
2454,-6.886004,-11.808918,Understanding a Sequence of Sequences: Visual Exploration of Categorical States in Lake Sediment Cores,0,1.0,0,Andrea Unger;Nadine Dräger;Mike Sips;Dirk J. Lehmann
2455,-4.5538125,-23.124,CrystalBall: A Visual Analytic System for Future Event Discovery and Analysis from Social Media Data,1,1.0,0,Isaac Cho;Ryan Wesslen;Svitlana Volkova;William Ribarsky;Wenwen Dou
2456,5.795564,-22.794188,In Pursuit of Error: A Survey of Uncertainty Visualization Evaluation,0,2.0,0,Jessica Hullman;Xiaoli Qiao;Michael Correll;Alex Kale;Matthew Kay
2457,-10.363943,4.603929,Where's My Data? Evaluating Visualizations with Missing Data,0,2.0,0,Hayeong Song;Danielle Albers Szafir
2458,-5.0123987,-42.10634,IDMVis: Temporal Event Sequence Visualization for Type 1 Diabetes Treatment Decision Support,0,2.0,0,Yixuan Zhang;Kartik Chanana;Cody Dunne
2459,12.417472,18.887178,Comparing Similarity Perception in Time Series Visualizations,0,2.0,0,Anna Gogolou;Theophanis Tsandilas;Themis Palpanas;Anastasia Bezerianos
2460,-15.160072,25.050522,A Visual Analytics Framework for the Detection of Anomalous Call Stack Trees in High Performance Computing Applications,0,2.0,1,Cong Xie;Wei Xu;Klaus Mueller
2461,35.963425,21.344276,Ray traced scalar fields with shaded polygonal output,1,0.0,0,R.J. Meyers;M.B. Stephenson
2462,-36.79436,-15.157727,Two widely-different architectural approaches to computer image generation,1,0.0,0,H.W. Park;K.S. Eo;D.L. Kim;B.K. Choi;Y. Kim;T. Alexander
2463,-3.892903,50.708157,Direct volumetric visualization,1,0.0,0,R.D. Williams;F.L. Wefer;T.E. Clifton
2464,-0.3968987,14.093935,Orientation maps: Techniques for visualizing rotations (A  Consumer's Guide),1,0.0,0,B. Alpern;L. Carter;M. Grayson;C. Pelkie
2465,-18.380993,5.7906013,Visualization and modeling of geophysical data,1,0.0,0,G. Celniker;I. Chakravarty;J. Moorman
2466,-28.44169,7.7497644,Integrating spatial data display with virtual reconstruction,1,0.0,0,P. Peterson;B. Hayden;F.D. Fracchia
2467,-23.654049,-11.851587,The design and implementation of the Cortex visualization system,1,0.0,0,D. Banerjee;C. Morley;W. Smith
2468,2.5207489,14.303258,Introducing alpha shapes for the analysis of path integral Monte Carlo results,1,0.0,0,P.J. Moran;M. Wagner
2469,-5.112108,14.497568,Visualizing polycrystalline orientation microstructures with spherical color maps,1,0.0,0,B. Yamrom;J.A. Sutliff;A.P. Woodfield
2470,-27.99143,-40.25309,Research report: improving browsing in information by the automatic display layout,1,0.0,0,P. Luders;R. Ernst
2471,29.536793,24.24774,Astronomers and their shady algorithms,1,0.0,0,R.E. Gooch
2472,32.301144,-18.5239,Using visualization in the archaeological excavations of a pre-Inca temple in Peru,1,0.0,0,A.D. Kalvin;A. Remy;O. Ardito;K. Morla;E. Nolasco;J. Prado;R. Franco;A. Murga;G. Wiese
2473,3.1026528,-33.786976,Data level comparative visualization in aircraft design,1,0.0,0,J. Trapp;H.-G. Pagendarm
2474,-8.301846,-28.917404,Case Study: Visual access for landscape event based temporal data,1,0.0,0,M. Sheelagh T. Carpendale;A. Fall;D.J. Cowperthwaite;J. Fall;F.D. Fracchia
2475,12.051391,-40.56479,Visualization of plant growth,1,0.0,0,J.J. Loomis;Xiuwen Liu;Zhaohua Ding;K. Fujimura;M.L. Evans;H. Ishikawa
2476,-17.296844,21.561201,Comparative visualization of protein structure-sequence alignments,1,0.0,0,M. Hansen;D. Meads;A. Pang
2477,54.396694,-17.458048,Multi-Source Data Analysis Challenges,2,0.0,0,S. Uselton;J. Ahrens;W. Bethel;L. Treinish;A. State
2478,52.737843,-19.39803,Automation or interaction: what's best for big data?,2,0.0,0,D. Kenwright
2479,18.74141,49.010365,Mastering interactive surface rendering for Java-based diagnostic applications,1,0.0,0,L. Mroz;R. Wegenkittl;E. Groller
2480,30.702642,-17.38583,PingTV: A Case Study in Visual Network Monitoring,1,0.0,0,A. Gubin;W. Yurcik;L. Brumbaugh
2481,19.294321,-14.719202,Case study: medical Web service for the automatic 3D documentation for neuroradiological diagnosis,1,0.0,0,S. Iserhardt-Bauer;P. Hastreiter;T. Ertl;K. Eberhardt;B. Tomandl
2482,-32.6805,-21.783781,Case study: visual debugging of cluster hardware,1,0.0,0,P. Crossno;R. Haynes
2483,-33.97317,-8.202045,Case study: an environment for understanding protein simulations using game graphics,1,0.0,0,D. Gresh;F. Suits;Yuk Yin Sham
2484,21.797365,54.359997,Exploring surface characteristics with interactive Gaussian images (a case study),1,0.0,0,B. Lowekamp;P. Rheingans;T.S. Yoo
2485,32.709248,1.4505343,An experimental evaluation of continuous semantic zooming in program visualization,1,0.0,0,K.L. Summers;T.E. Goldsmith;S. Kubica;T.P. Caudell
2486,16.623983,55.91026,Conveying shape with texture: an experimental investigation of the impact of texture type on shape categorization judgments,1,0.0,0,Sunghee Kim;H. Hagh-Shenas;V. Interrante
2487,13.300247,-43.943306,Visualizing spatial and temporal variability in coastal observatories,1,0.0,0,W.H. Jimenez;W.T. Correa;C.T. Silva;A.M. Baptista
2488,8.0844555,-36.424026,EZEL: a Visual Tool for Performance Assessment of Peer-to-Peer File-Sharing Network,1,0.0,0,L. Voinea;A. Telea;J.J. van Wijk
2489,52.75973,-19.7537,Keynote Address: From Information Visualization to Sensemaking: Connecting the Mind's Eye to the Mind's Muscle,2,0.0,0,S. Card
2490,16.22914,-20.020168,An Experimental Investigation of Magnification Lens Offset and Its Impact on Imagery Analysis,2,0.0,0,E. Darling;C. Newbern;N. Kalghatgi;A. Burgman;K. Recktenwald
2491,39.533997,-2.0111995,TextPool: Visualizing Live Text Streams,2,0.0,0,C. Albrecht-Buehler;B. Watson;D.A. Shamma
2492,-19.617073,23.469456,ARNA: Interactive Comparison and Alignment of RNA Secondary Structure,2,0.0,0,G. Gainant;D. Auber
2493,4.8481064,27.668926,Visualizing High Dimensional Datasets Using Partiview,2,0.0,0,D. Surendran;S. Levy
2494,-40.866547,11.777642,Intuitive and interactive modification of large finite element models,1,1.0,0,D. Rose;K. Bidmon;T. Ertl
2495,-17.82061,25.940508,Highlighting conflict dynamics in event data,1,0.0,0,U. Brandes;D. Fleischer;J. Lerner
2496,-29.444143,-9.444813,The software interface to the 3D-force microscope,1,0.0,0,D. Marshburn;C. Weigle;B.G. Wilde;R.M. Taylor;K. Desai;J.K. Fisher;J. Cribb;E.T. O'Brien;R. Superfine
2497,15.960111,5.6185055,Complex Logarithmic Views for Small Details in Large Contexts,0,0.0,0,Joachim Bottger;Michael Balzer;Oliver Deussen
2498,0.92474824,34.196693,Visualizing the Performance of Computational Linguistics Algorithms,1,0.0,0,Stephen G. Eick;Justin Mauger;Alan Ratner
2499,-29.088032,-30.382126,Visual Exploration of Spatio-temporal Relationships for Scientific Data,1,0.0,0,Sameep Mehta;Srinivasan Parthasarathy;Raghu Machiraju
2500,-22.256567,-4.325093,Analyzing Complex FTMS Simulations: a Case Study in High-Level Visualization of Ion Motions,0,0.0,0,Wojciech Burakiewicz;Robert Van Liere
2501,3.0739446,2.820659,IStar: A Raster Representation for Scalable Image and Volume Data,0,0.0,0,Joe Kniss;Warren Hunt;Kristin Potter;Pradeep Sen
2502,26.381817,12.144608,Virtual Rheoscopic Fluids for Flow Visualization,0,0.0,0,William Barth;Christopher Burns
2503,40.716507,15.963259,Interactive poster: Interactive multiobjective optimization - a new application area for visual analytics,2,0.0,0,Suvi Tarkkanen;Kaisa Miettinen;Jussi Hakanen
2504,33.325428,25.948935,Volume Illustration of Muscle from Diffusion Tensor Images,0,1.0,0,Wei Chen;Zhicheng Yan;Song Zhang;John Allen Crow;David S. Ebert;Ronald M. McLaughlin;Katie B. Mullins;Robert Cooper;Zi'ang Ding;Jun Liao
2505,-9.347849,-1.0611523,Automated measures for interpretable dimensionality reduction for visual classification: A user study,2,0.0,0,Ilknur Icke;Andrew Rosenberg
2506,13.407486,-40.248108,epSpread - Storyboarding for visual analytics,2,0.0,0,Llyr ap Cenydd;Rick Walker;Serban Pop;Helen Miles;Chris Hughes;William Teahan;Jonathan C. Roberts
2507,7.6783295,-6.322939,Artificial Defocus for Displaying Markers in Microscopy Z-Stacks,0,1.0,1,Alessandro Giusti;Pierluigi Taddei;Giorgio Corani;Luca Gambardella;Cristina Magli;Luca Gianaroli
2508,-35.243618,12.003693,Coherency-Based Curve Compression for High-Order finite Element Model Visualization,0,1.0,0,Alexander Bock;Erik Sundén;Bingchen Liu;Burkhard Wünsche;Timo Ropinski
2509,-20.588326,-23.244541,KnotPad: Visualizing and Exploring Knot Theory with Fluid Reidemeister Moves,0,1.0,0,Hui Zhang;Jianguang Weng;Lin Jing;Yiwen Zhong
2510,-27.391628,6.0855207,Visual Data Analysis as an Integral Part of Environmental Management,0,0.0,0,Joerg Meyer;Glenn Taylor;Ben Torkian;Timothy C. Johnson;Ian Gorton;E. Wes Bethel;Jennifer L. Horsman;Susan S. Hubbard;Harinarayan Krishnan;Alexandru Romosan;Elizabeth H. Keating;Laura Monroe;Richard Strelitz;Phil Moore
2511,-15.295935,-9.59758,Visual Steering and Verification of Mass Spectrometry Data Factorization in Air Quality Research,0,1.0,0,Daniel Engel;Klaus Greff;Christoph Garth;Keith Bein;Anthony Wexler;Bernd Hamann;Hans Hagen
2512,-17.771305,21.487244,A case study: Tracking and visualizing the evolution of dark matter halos and groups of satellite halos in cosmology simulations,2,0.0,0,Jay Takle;Deborah Silver;Katrin Heitmann
2513,14.550651,16.093208,Visual exploration of local interest points in sets of time series,2,0.0,0,Tobias Schreck;Lyubka Sharalieva;Franz Wanner;Jürgen Bernard;Tobias Ruppert;Tatiana von Landesberger;Benjamin Bustos
2514,-6.4982886,-34.024807,Exploring the impact of emotion on visual judgement,2,0.0,0,Lane Harrison;Remco Chang;Aidong Lu
2515,-23.61455,-22.459785,Smart super views---A knowledge-assisted interface for medical visualization,1,1.0,0,Gabriel Mistelbauer;Arnold Köchl;Rudiger Schernthaner;Ivan Baclija;Rüdiger Schernthaner;Stefan Bruckner;Milos Sramek;Meister Eduard Gröller
2516,3.4448025,-55.8564,Visualizing Request-Flow Comparison to Aid Performance Diagnosis in Distributed Systems,0,1.0,0,Raja R. Sambasivan;Ilari Shafer;Michelle L. Mazurek;Gregory R. Ganger
2517,6.540616,-22.460669,Evaluation of Static and Dynamic Visualization Training Approaches for Users with Different Spatial Abilities,0,1.0,0,Maria-Elena Froese;Melanie Tory;Guy-Warwick Evans;Kedar Shrikhande
2518,-7.923581,43.335598,Predicate-Based Focus-and-Context Visualization for 3D Ultrasound,0,0.0,0,Christian Schulte zu Berge;Maximilian Baust;Ankur Kapoor;Nassir Navab
2519,-19.161491,-29.996407,Footprints: A Visual Search Tool that Supports Discovery and Coverage Tracking,0,1.0,0,Ellen Isaacs;Kelly Damico;Shane Ahern;Eugene Bart;Mudita Singhal
2520,-12.179861,46.197292,A Classification of User Tasks in Visual Analysis of Volume Data,1,1.0,0,Bireswar Laha;Doug A. Bowman;David H. Laidlaw;John J. Socha
2521,11.730561,15.404739,Real-time Uncertainty Visualization for B-Mode Ultrasound,1,0.0,0,Christian Schulte Zu Berge;Denis Declara;Christoph Hennersperger;Maximilian Baust;Nassir Navab
2522,38.835617,17.826056,"Extracting, Tracking, and Visualizing Magnetic Flux Vortices in 3D Complex-Valued Superconductor Simulation Data",0,1.0,0,Hanqi Guo;Carolyn L. Phillips;Tom Peterka;Dmitry Karpeyev;Andreas Glatz
2523,14.554965,16.145075,Visual Analytics for Development and Evaluation of Order Selection Criteria for Autoregressive Processes,0,1.0,0,Thomas Löwe;Emmy-Charlotte Förster;Georgia Albuquerque;Jens-Peter Kreiss;Marcus Magnor
2524,-14.064867,-40.619335,Synteny Explorer: An Interactive Visualization Application for Teaching Genome Evolution,0,2.0,0,Chris Bryan;Gregory Guterman;Kwan-Liu Ma;Harris Lewin;Denis Larkin;Jaebum Kim;Jian Ma;Marta Farré
2525,31.76971,42.31554,Glyphs for General Second-Order 2D and 3D Tensors,0,0.0,0,Tim Gerrits;Christian Rössl;Holger Theisel
2526,6.9504538,-5.5347376,Categorical Colormap Optimization with Visualization Case Studies,0,2.0,0,H. Fang;S. Walton;E. Delahaye;J. Harris;D. A. Storchak;M. Chen
2527,18.443302,19.10725,Correlated Photon Mapping for Interactive Global Illumination of Time-Varying Volumetric Data,0,1.0,1,Daniel Jönsson;Anders Ynnerman
2528,19.200434,-29.357946,Blinded with Science or Informed by Charts? A Replication Study,0,2.0,0,Pierre Dragicevic;Yvonne Jansen
2529,7.2764997,29.489212,Dynamic Load Balancing Based on Constrained K-D Tree Decomposition for Parallel Particle Tracing,0,1.0,0,Jiang Zhang;Hanqi Guo;Fan Hong;Xiaoru Yuan;Tom Peterka
2530,35.11832,2.8145351,An Intelligent System Approach for Probabilistic Volume Rendering Using Hierarchical 3D Convolutional Sparse Coding,0,1.0,0,Tran Minh Quan;Junyoung Choi;Haejin Jeong;Won-Ki Jeong
2531,-44.3532,8.382659,Uncertainty Visualization Using Copula-Based Analysis in Mixed Distribution Models,0,2.0,0,Subhashis Hazarika;Ayan Biswas;Han-Wei Shen
2532,-12.71617,40.74571,Interactive Dynamic Volume Illumination with Refraction and Caustics,0,1.0,0,Jens G. Magnus;Stefan Bruckner
2533,-30.272753,-16.410067,Visualization Multi-Pipeline for Communicating Biology,0,1.0,0,Peter Mindek;David Kouřil;Johannes Sorger;Daniel Toloudis;Blair Lyons;Graham Johnson;M. Eduard Gröller;Ivan Viola
2534,-10.756979,13.582579,Globe Browsing: Contextualized Spatio-Temporal Planetary Surface Visualization,0,2.0,1,Karl Bladin;Emil Axelsson;Erik Broberg;Carter Emmart;Patric Ljung;Alexander Bock;Anders Ynnerman
2535,-3.4907374,-10.210101,BiDots: Visual Exploration of Weighted Biclusters,0,1.0,0,Jian Zhao;Maoyuan Sun;Francine Chen;Patrick Chiu
2536,-15.393852,25.061867,Structure-Based Suggestive Exploration: A New Approach for Effective Exploration of Large Networks,0,2.0,0,Wei Chen;Fangzhou Guo;Dongming Han;Jacheng Pan;Xiaotao Nie;Jiazhi Xia;Xiaolong Zhang
2537,-30.581251,7.611273,A Declarative Rendering Model for Multiclass Density Maps,0,2.0,0,Jaemin Jo;Frédéric Vernier;Pierre Dragicevic;Jean-Daniel Fekete
2538,11.314758,-21.92869,A Framework for Creative Visualization-Opportunities Workshops,0,2.0,0,Ethan Kerzner;Sarah Goodwin;Jason Dykes;Sara Jones;Miriah Meyer
2539,18.286787,-5.6712246,Persistence Atlas for Critical Point Variability in Ensembles,0,2.0,0,Guillaume Favelier;Noura Faraj;Brian Summa;Julien Tierny
2540,-19.743992,20.907715,Interactive Visualization of RNA and DNA Structures,0,1.0,0,Norbert Lindow;Daniel Baum;Morgan Leborgne;Hans-Christian Hege
2541,-18.33704,26.729305,Labels on Levels: Labeling of Multi-Scale Multi-Instance and Crowded 3D Biological Environments,0,2.0,1,David Kouřil;Ladislav Čmolík;Barbora Kozlíková;Hslanc-Yun Wu;Graham Johnson;David S. Goodsell;Arthur Olson;M. Eduard Gröller;Ivan Viola
2542,-42.051918,6.802073,iForest: Interpreting Random Forests via Visual Analytics,0,2.0,0,Xun Zhao;Yanhong Wu;Dik Lun Lee;Weiwei Cui
2543,-7.443697,-14.587404,Analysis of Flight Variability: a Systematic Approach,0,2.0,0,Natalia Andrienko;Gennady Andrienko;Jose Manuel Cordero Garcia;David Scarlatti
2544,-10.088285,-17.203663,MAQUI: Interweaving Queries and Pattern Mining for Recursive Event Sequence Exploration,0,1.0,0,Po-Ming Law;Zhicheng Liu;Sana Malik;Rahul C. Basole
2545,18.378735,23.914488,MotionRugs: Visualizing Collective Trends in Space and Time,0,2.0,0,Juri Buchmüller;Dominik Jäckle;Eren Cakmak;Ulrik Brandes;Daniel A. Keim
2546,-22.272593,-25.822124,Drag and Track: A Direct Manipulation Interface for Contextualizing Data Instances within a Continuous Parameter Space,0,2.0,0,Daniel Orban;Daniel F. Keefe;Ayan Biswas;James Ahrens;David Rogers
2547,24.36364,52.89967,Techniques for visualizing 3-dimensional manifolds,1,0.0,0,M.J. Laszlo
2548,-40.63679,-9.612817,A graphical interface for robotic remediation of underground storage tanks,1,0.0,0,B.K. Christensen;L.M. Desjarlais
2549,6.0351777,-37.700035,The electronic structure of oxygen in silicon as revealed by volume visualization of Ab initio calculations,1,0.0,0,R.H. Wolfe;M. Needels;J.D. Joannopoulos
2550,-27.504087,-11.483575,Visualizing environmental data for program decision support,1,0.0,0,J. Burnetti;R. Manley;W. Mitchell;D. Varnadore
2551,7.8261247,-18.480833,Flow visualization as a basic tool to investigate the dynamics and topology of jets,1,0.0,0,F.F. Grinstein;U.R. Obeysekare;G. Patnaik
2552,-41.477016,-8.050707,A climate simulation case study,1,0.0,0,P.C. Chen
2553,-48.86363,3.5556588,A 3D Contextual Shading Method for Visualization of Diecasting Defects,1,0.0,0,S.C. Lu;A.B. Rebello;D.H. Cui;R. Yagel;R.A. Miller;G.L. Kinzel
2554,-30.902208,5.0125957,Rear-projecting virtual data onto physical terrain: an exercise in two senses being better than one,1,0.0,0,D. Clark;R. Marciano;R. McKeon;M. Bailey
2555,30.219738,-17.727598,DELTA's Virtual Physics Laboratory: a comprehensive learning platform on physics and astronomy,1,0.0,0,S. Chakaveh;U. Zlender;D. Skaley;K. Fostiropoulos;D. Breitschwerdt
2556,-18.085346,-42.64569,An integrated visualization and design toolkit for flexible prosthetic heart valves,1,0.0,0,A.J. Fenlon;T. David;J.P.R.B. Walton
2557,52.31351,-21.013248,Battlespace visualization: a grand challenge,2,0.0,0,J.L. Posdamer;J. Dantone;N. Gershon;J. Dale;T. Hamburger;W. Page
2558,31.285162,2.810638,Approximate shading for the re-illumination of synthetic images,1,0.0,0,R. Scoggins;R. Machiraju;R.J. Moorhead
2559,32.154873,-9.418731,Graphical strategies to convey functional relationships in the human brain: a case study,1,0.0,0,T. Welsh;K. Mueller;Wei Zhu;N. Volkow;J. Meade
2560,30.586885,-21.955446,"Semi-immersive space mission design and visualization: case study of the ""Terrestrial Planet Finder"" mission",1,0.0,0,K. Museth;A. Barr;M.W. Lo
2561,-6.6862407,-2.945175,Visualizing biosequence data using texture mapping,1,0.0,0,P.R. Thiagarajan;G.R. Gao
2562,-5.1320705,-48.56958,Exploding the frame: designing for wall-size computer displays,2,0.0,0,B. Shedd
2563,-25.90556,-44.858707,Psychophysical scaling of a cardiovascular information display,1,0.0,0,R. Albert;N. Syroid;Y. Zhang;J. Agutter;F. Drews;D. Strayer;G. Hutchinson;D. Westenskow
2564,38.4498,15.964202,Fairing scalar fields by variational modeling of contours,1,0.0,0,M. Bertram
2565,55.297783,-18.641684,Capstone Address: Visualization as a Medium for Capturing and Sharing Thoughts,2,0.0,0,S. Roth
2566,15.433814,-36.99019,Hypothesis Visualization,2,0.0,0,D. Cluxton;S.G. Eick;Jie Yun
2567,43.50308,30.20708,MonkEllipse: Visualizing the History of Information Visualization,2,0.0,0,Tzu-Wei Hsu;L. Inman;D. McColgin;K. Stamper
2568,-24.11441,-24.60546,Tracking User Interactions Within Visualizations,2,0.0,0,D.P. Groth;B.W. Murphy
2569,-2.0302517,-3.3122318,Visualizing cortical waves and timing from data,1,0.0,0,K.A. Robbins;M. Robinson;D.M. Senseman
2570,-8.165636,49.5491,Volume refinement fairing isosurfaces,1,0.0,0,M. Bertram
2571,-7.787346,-52.19601,Code Checking and Visualization of an Architecture Design,2,0.0,0,Rong Xu;W. Solihin;Zhiyong Huang
2572,55.471947,-21.101076,Automatic Fast Detection of Tumor Suspect Areas on CT Scan,2,0.0,0,M. Mancas;B. Gosselin;B. Macq
2573,40.553406,14.915492,Exploring 2D tensor fields using stress nets,1,0.0,0,A. Wilson;R. Brannon
2574,9.109499,32.57253,Composite Rectilinear Deformation for Stretch and Squish Navigation,0,0.0,0,James Slack;Tamara Munzner
2575,16.822851,-16.433767,InfoVis as Seen by the World Out There: 2007 in Review,2,0.0,0,Stephen Few
2576,-37.61703,10.7246,Formalizing Analytical Discourse in Visual Analytics,2,0.0,0,Guoray Cai
2577,15.534702,-35.852455,Intelligence Analysis Using Titan,2,0.0,0,Patricia Crossno;Brian Wylie;Andrew Wilson;John Greenfield;Eric Stanton;Timothy Shead;Lisa Ice;Kenneth Moreland;Jeffrey Baumes;Berk Geveci
2578,-1.7615459,24.461317,Generating hypotheses of trends in high-dimensional data skeletons,1,0.0,0,Chandan K. Reddy;Snehal Pokharkar;Tin Kam Ho
2579,6.8884764,17.558222,Using SocialAction to uncover structure in social networks over time,2,0.0,0,Adam Perer
2580,-26.14546,-37.909904,SpicyNodes: Radial Layout Authoring for the General Public,0,1.0,0,Michael Douma;Grzegorz Ligierko;Ovidiu Ancuta;Pavel Gritsai;Sean Liu
2581,9.536621,31.93925,Geovisual analytics for self-organizing network data,1,0.0,0,Van Quan Ho;Tobias Astrom;Mikael Jern
2582,-16.993534,20.947418,Multiple step social structure analysis with Cytoscape,2,0.0,0,Hao Zhou;Anna A. Shaverdian;H.V. Jagadish;George Michailidis
2583,15.425092,-37.016685,Detecting and analyzing relationships among anomalies,2,0.0,0,David Allen;Tsai-Ching Lu;Dave Huber
2584,-9.78642,-1.7359952,Integrative visual analytics for suspicious behavior detection,2,0.0,0,Peter Bak;Christian Rohrdantz;Svenja Leifert;Christoph Granacher;Stefan Koch;Simon Butscher;Patrick Jungk;Daniel A. Keim
2585,-22.11163,-28.60183,ALIDA: Using machine learning for intent discernment in visual analytics interfaces,2,0.0,0,Tera Marie Green;Ross Maciejewski;Steve DiPaola
2586,-0.42113265,1.5345798,Data representation and exploration with Geometric Wavelets,2,0.0,0,Eric E. Monson;Guangliang Chen;Rachael Brady;Mauro Maggioni
2587,-10.108263,-37.39507,KD-photomap: Exploring photographs in space and time,2,0.0,0,Iulian Peca;Haolin Zhi;Katerina Vrotsou;Natalia Andrienko;Gennady Andrienko
2588,14.839287,-40.798283,"An integrated visualization on network events VAST 2011 mini challenge #2 award: ""Outstanding integrated overview display""",2,0.0,0,Walter Marcelo Lamagna
2589,14.63904,-46.1877,ManyVis: Multiple Applications in an Integrated Visualization Environment,0,1.0,0,Atul Rungta;Brian Summa;Dogan Demir;Peer-Timo Bremer;Valerio Pascucci
2590,-13.371526,-2.1892052,An Integrated Visual Analysis System for Fusing MR Spectroscopy and Multi-Modal Radiology Imaging,1,0.0,0,Miguel Nunes;Benjamin Rowland;Matthias Schlachter;Soléakhéna Ken;Kresimir Matkovic;Anne Laprie;Katja Bühler
2591,40.853786,23.842136,Feature-Based Tensor Field Visualization for Fiber Reinforced Polymers,1,0.0,0,Valentin Zobel;Markus Stommel;Gerik Scheuermann
2592,-34.26682,-14.501645,OpenSpace: Public dissemination of space mission profiles,2,0.0,0,Alexander Bock;Michal Marcinkowski;Joakim Kilby;Carter Emmart;Anders Ynnerman
2593,-38.28737,7.565195,3D superquadric glyphs for visualizing myocardial motion,2,0.0,0,Teodora Chitiboi;Mathias Neugebauer;Susanne Schnell;Michael Markl;Lars Linsen
2594,-6.605624,1.1918496,Reconstruction and Visualization of Coordinated 3D Cell Migration Based on Optical Flow,0,2.0,0,Christopher P. Kappe;Lucas Schütz;Stefan Gunther;Lars Hufnagel;Steffen Lemke;Heike Leitte
2595,37.078983,21.411966,Multi-field Pattern Matching based on Sparse Feature Sampling,0,1.0,0,Zhongjie Wang;Hans-Peter Seidel;Tino Weinkauf
2596,13.04074,16.631355,Visually and statistically guided imputation of missing values in univariate seasonal time series,2,0.0,0,M. Bögl;P. Filzmoser;T. Gschwandtner;S. Miksch;W. Aigner;A. Rind;T. Lammarsch
2597,-6.702719,-27.84836,Visual Analytics for fraud detection and monitoring,2,0.0,0,Roger A. Leite;Theresia Gschwandtner;Silvia Miksch;Erich Gstrein;Johannes Kuntner
2598,-6.9150867,-33.218346,Quantifying the Visual Impact of Classification Boundaries in Choropleth Maps,0,2.0,0,Yifan Zhang;Ross Maciejewski
2599,40.28336,23.75887,Backward Finite-Time Lyapunov Exponents in Inertial Flows,0,2.0,0,Tobias Günther;Holger Theisel
2600,-13.411202,35.6698,Progressive Direct Volume-to-Volume Transformation,0,1.0,0,Steffen Frey;Thomas Ertl
2601,-16.463163,-27.963737,SocialBrands: Visual analysis of public perceptions of brands on social media,1,1.0,0,Xiaotong Liu;Anbang Xu;Liang Gou;Haibin Liu;Rama Akkiraju;Han-Wei Shen
2602,22.988518,-8.205949,Structuring Visualization Mock-Ups at the Graphical Level by Dividing the Display Space,0,2.0,0,Romain Vuillemot;Jeremy Boy
2603,-36.85388,2.994896,Understanding the Relationship Between Interactive Optimisation and Visual Analytics in the Context of Prostate Brachytherapy,0,1.0,0,Jie Liu;Tim Dwyer;Kim Marriott;Jeremy Millar;Annette Haworth
2604,-39.130253,1.3732978,Graphiti: Interactive Specification of Attribute-Based Edges for Network Modeling and Visualization,0,1.0,0,Arjun Srinivasan;Hyunwoo Park;Alex Endert;Rahul C. Basole
2605,-12.615196,-12.071586,E-Map: A Visual Analytics Approach for Exploring Significant Event Evolutions in Social Media,1,2.0,0,Siming Chen;Shuai Chen;Lijing Lin;Xiaoru Yuan;Jie Liang;Xiaolong Zhang
2606,-36.801872,-17.75696,A Visual Analytics System for Optimizing Communications in Massively Parallel Applications,1,2.0,0,Takanori Fujiwara;Preeti Malakar;Khairi Reda;Venkatram Vishwanath;Michael E. Papka;Kwan-Liu Ma
2607,3.1723285,-0.7889794,Face to Face: Evaluating Visual Comparison,0,2.0,0,Brian Ondov;Nicole Jardine;Niklas Elmqvist;Steven Franconeri
2608,-6.370378,-40.75728,A Framework for Externalizing Implicit Error Using Visualization,0,2.0,0,Nina Mccurdy;Julie Gerdes;Miriah Meyer
